level_0,index,created_at,text,url,replies,retweets,favorites,user,bioguide_id,party,state
9549,234387,2017-09-27 14:28:00,Senate passed my legislation w/ @SenBillNelson & ; @SenGaryPeters to help combat harmful algal blooms:  ,https://twitter.com/senrobportman/status/913047652295639040,17,10,29,senrobportman,P000449,R,OH
9550,234388,2017-09-27 14:14:00,"Enjoyed meeting w/ Ohioans interested in #taxreform, pensions, #healthcare & ; more during this morning's constituentäó_  ",https://twitter.com/senrobportman/status/913044133316562950,55,7,19,senrobportman,P000449,R,OH
9551,234389,2017-09-27 13:45:00,I've visited treatment centers in towns like Youngstown. New grant $ will help them push back against addiction: ,https://twitter.com/senrobportman/status/913036756873748480,25,4,11,senrobportman,P000449,R,OH
9552,234390,2017-09-27 13:38:00,I authored #DrugFreeCommunities Act 20 years ago & ; now it is needed more than ever. More resources on way to Cincy: ,https://twitter.com/senrobportman/status/913034995891019778,20,4,8,senrobportman,P000449,R,OH
9553,234391,2017-09-26 22:48:00,Celebrating Tim O'Neill's 27 years of federal service. His perseverance and dedication is an ex le to all of us.  ,https://twitter.com/senrobportman/status/912811045202231296,14,5,8,senrobportman,P000449,R,OH
9554,234392,2017-09-26 22:12:00,I offer a special thank you to our first responders like #Ohio Task Force 1 (#OHTF1) who are helping in the hurricaäó_  ,https://twitter.com/senrobportman/status/912801967897927680,12,8,31,senrobportman,P000449,R,OH
9555,234393,2017-09-26 21:58:00,"My heart goes out to all those in TX, FL, the Virgin Islands, Puerto Rico & ; elsewhere who are rebuilding after devaäó_  ",https://twitter.com/senrobportman/status/912798440362467328,103,19,70,senrobportman,P000449,R,OH
9556,234394,2017-09-26 21:00:00,Fayette County has been hit hard by the #opioidcrisis. Funding will help those on the front lines:   Via @recordherald,https://twitter.com/senrobportman/status/912783838388002816,22,6,7,senrobportman,P000449,R,OH
9557,234395,2017-09-26 20:40:00,Pleased that #DrugFreeCommunities program through @ONDCP is working to combat the #opioidcrisis.äó_  ,https://twitter.com/senrobportman/status/912778822310866945,14,4,4,senrobportman,P000449,R,OH
9558,234396,2017-09-26 19:58:00,Thx @CVSHealth for working to combat the #opioidcrisis. We must all work together to turn the tide of addiction:  ,https://twitter.com/senrobportman/status/912768236508155904,38,12,30,senrobportman,P000449,R,OH
9559,234397,2017-09-26 19:27:00,Thx @SenatorBurr for adding your name to the growing list of bipartisan Senators backing the Stop Enabling Sex Traffickers Act (#SESTA).,https://twitter.com/senrobportman/status/912760435228708870,8,4,10,senrobportman,P000449,R,OH
9560,234398,2017-09-26 19:22:00,Thank you @DickDurbin for supporting the bipartisan Stop Enabling Sex Traffickers Act (#SESTA) and your leadership to #EndHumanTrafficking,https://twitter.com/senrobportman/status/912759176987910144,13,5,16,senrobportman,P000449,R,OH
9561,234399,2017-09-26 19:14:00,"A reminder on what #SESTA is all about:#CDA230 #EndHumanTrafficking #Bipartisanship  ",https://twitter.com/senrobportman/status/912757178666172416,14,16,23,senrobportman,P000449,R,OH
9562,234400,2017-09-26 19:02:00,We must lower #healthcare premiums & ; I support this effort led by @SenCoryGardner  ,https://twitter.com/senrobportman/status/912754383670128642,108,23,37,senrobportman,P000449,R,OH
9563,234401,2017-09-26 18:53:00,"Every day the Senate does not act, more women & ; children are trafficked online. We must act on #SESTA to help stopäó_  ",https://twitter.com/senrobportman/status/912751898532483075,29,10,16,senrobportman,P000449,R,OH
9564,234402,2017-09-26 18:38:00,#SESTA narrowly targets only those who knowingly facilitate sex trafficking. That's why it is so widely supported.  ,https://twitter.com/senrobportman/status/912748195565928448,15,4,7,senrobportman,P000449,R,OH
9565,234403,2017-09-26 18:15:00,.@MissingKids says that more than 80% of reported child trafficking happens online. The main culprit is #Backpage.äó_  ,https://twitter.com/senrobportman/status/912742350262341637,18,20,14,senrobportman,P000449,R,OH
9566,234404,2017-09-26 15:06:00,Huge investment in #Ohio workers and Ohio steel! All OH workers need is a level playing field to win & ; thrive:   #Jobs,https://twitter.com/senrobportman/status/912694915020320768,50,12,29,senrobportman,P000449,R,OH
9567,234405,2017-09-25 22:05:00,Discussed #GrahamCassidy at Finance hearing & ; shared stories from Ohioans impacted by skyrocketing #Healthcare costs: ,https://twitter.com/senrobportman/status/912438013053095939,436,10,39,senrobportman,P000449,R,OH
9568,234406,2017-09-25 18:53:00,I spoke about the impact of the #opioidcrisis on #Ohio in a recent convo w/ @thehill. You can watch here:   #STOPAct,https://twitter.com/senrobportman/status/912389491951902722,69,3,9,senrobportman,P000449,R,OH
9569,234407,2017-09-25 18:49:00,The #STOPAct addresses the devastating impact of fentanyl & ; other drugs being sent from countries like #China.  ,https://twitter.com/senrobportman/status/912388494365822976,44,5,14,senrobportman,P000449,R,OH
9570,234408,2017-09-25 18:47:00,The #opioidcrisis continues to devastate #Ohio. There is a bill that Congress can act on called the #STOPAct that wäó_  ,https://twitter.com/senrobportman/status/912387996296425472,80,6,15,senrobportman,P000449,R,OH
9571,234409,2017-09-25 18:24:00,#SESTA is gaining momentum here in Congress & ; around the country as support continues to grow. Imp't reminder of whäó_  ,https://twitter.com/senrobportman/status/912382195427192833,40,27,35,senrobportman,P000449,R,OH
9572,234410,2017-09-25 18:00:00,#Ohio #smallbiz owners deserve fewer regulatory burdens & ; a simpler tax code:   #TaxReform #Jobs,https://twitter.com/senrobportman/status/912376258037678080,74,6,9,senrobportman,P000449,R,OH
9573,234411,2017-09-25 17:48:00,"Last wk, @SBALinda & ; I heard from #smallbiz owners in #Ohio who are facing serious roadblocks to growing their bizäó_  ",https://twitter.com/senrobportman/status/912373371136102401,37,2,6,senrobportman,P000449,R,OH
9574,234412,2017-09-25 17:03:00,Important @GOPSenFinance hearing today on the #GrahamCassidy #healthcare plan. Look forward to hearing from the witnesses,https://twitter.com/senrobportman/status/912361839643840514,375,16,49,senrobportman,P000449,R,OH
9575,234413,2017-09-24 21:15:00,Too many #Ohio biz  are saddled w/ burdensome regulations & ; high taxes. Congress needs to get moving on #taxreform & ; reg form.,https://twitter.com/senrobportman/status/912062840516747265,284,22,85,senrobportman,P000449,R,OH
9576,234414,2017-09-24 20:00:00,27 new grants recently announced to help #Ohio turn the tide of addiction. See where these grants are headed here:  ,https://twitter.com/senrobportman/status/912043969256632320,112,16,28,senrobportman,P000449,R,OH
9577,234415,2017-09-24 19:27:00,The Drug-Free Communities program is providing resources to those on the frontlines battling the #opioidcrisis:  ,https://twitter.com/senrobportman/status/912035661066186757,72,6,18,senrobportman,P000449,R,OH
9578,234416,2017-09-24 17:37:00,ICYMI: a powerful recap on the Senate hearing on #SESTA:  ,https://twitter.com/senrobportman/status/912007994736500736,34,10,9,senrobportman,P000449,R,OH
9579,234417,2017-09-24 16:10:00,Imp't that Congress act on my bipartisan North Korean Enablers Accountability Act to accomplish this objective: ,https://twitter.com/senrobportman/status/911986090545840129,75,4,5,senrobportman,P000449,R,OH
9580,234418,2017-09-24 16:05:00,The Trump Administration is right to put additional sanctions on entities that do business w/ #NorthKorea:  ,https://twitter.com/senrobportman/status/911984830933385216,76,6,20,senrobportman,P000449,R,OH
9581,234419,2017-09-23 22:03:00,Proud to support conservation efforts in #Ohio and across the country to protect our natural resources for future generations. #NHFday,https://twitter.com/senrobportman/status/911712603235389440,215,22,108,senrobportman,P000449,R,OH
9582,234420,2017-09-23 21:58:00,Happy National #huntingandfishingday to my fellow outdoorsmen! No better place to hunt and fish than right here inäó_  ,https://twitter.com/senrobportman/status/911711282000203777,90,13,55,senrobportman,P000449,R,OH
9583,234421,2017-09-23 20:23:00,Had the opportunity to visit those sites and more during my #Ohio defense tour last month. Thankful for the serviceäó_  ,https://twitter.com/senrobportman/status/911687367143989248,57,18,29,senrobportman,P000449,R,OH
9584,234422,2017-09-23 20:21:00,"#NDAA includes funding for the @180thFW in Toledo,  the JSMC in Lima, @WrightPattAFB in Dayton & ; more:  ",https://twitter.com/senrobportman/status/911686867229085696,28,3,5,senrobportman,P000449,R,OH
9585,234423,2017-09-23 18:08:00,"In our #smallbiz roundtable in Cbus this wk heard again abt the need 4 better workforce training, fewer regulatoryäó_  ",https://twitter.com/senrobportman/status/911653414441852929,75,5,7,senrobportman,P000449,R,OH
9586,234424,2017-09-23 18:06:00,#Smallbiz are the backbone of the #Ohio economy. Congress should not burden them w/ regulations & ; higher taxes:  #Jobs,https://twitter.com/senrobportman/status/911652890946818048,70,6,11,senrobportman,P000449,R,OH
9587,234425,2017-09-23 17:01:00,"If you haven't had the chance to watch it, I strongly urge you to watch Yvonne's testimony to see why #SESTA is neeäó_  ",https://twitter.com/senrobportman/status/911636550768717824,42,9,14,senrobportman,P000449,R,OH
9588,234426,2017-09-23 16:50:00,Thanks to the courage of mothers like Yvonne Ambrose who share their stories so we can prevent these tragedies fromäó_  ,https://twitter.com/senrobportman/status/911633766887579648,43,12,23,senrobportman,P000449,R,OH
9589,234427,2017-09-23 16:33:00,#SESTA is a narrowly-crafted bill that will hold companies like #Backpage accountable. It is widely supported: ,https://twitter.com/senrobportman/status/911629483937075200,54,13,16,senrobportman,P000449,R,OH
9590,234428,2017-09-23 16:25:00,Companies like #Backpage knowingly facilitate the selling of women & ; children online to increase their profits. Thiäó_  ,https://twitter.com/senrobportman/status/911627607854247938,66,125,125,senrobportman,P000449,R,OH
9591,234429,2017-09-22 19:44:00,Victims of #humantrafficking deserve justice. #SESTA will help get them that justice. #CDA230  ,https://twitter.com/senrobportman/status/911315180113485824,101,30,53,senrobportman,P000449,R,OH
9592,234430,2017-09-22 18:20:00,The Senate must act with urgency to hold online sex traffickers accountable for their crimes against women & ; childräó_  ,https://twitter.com/senrobportman/status/911294033451819008,101,43,72,senrobportman,P000449,R,OH
9593,234431,2017-09-22 18:01:00,It's too easy for drug traffickers from #China & ; other countries to ship drugs into the US. #STOPAct closes loophole: ,https://twitter.com/senrobportman/status/911289317288529920,60,8,10,senrobportman,P000449,R,OH
9594,234432,2017-09-22 17:52:00,Good column on why Congress must pass the #STOPAct to help keep drugs out of #Ohio & ; our communities:  ,https://twitter.com/senrobportman/status/911287107502706688,61,5,7,senrobportman,P000449,R,OH
9595,234433,2017-09-22 15:51:00,Yvonne Ambrose's courage to come forward & ; talk about the tragedy her family experienced demonstrates why Congressäó_  ,https://twitter.com/senrobportman/status/911256536697102336,50,9,31,senrobportman,P000449,R,OH
9596,234434,2017-09-22 14:13:00,#HumanTrafficking is a stain on our national character. #SESTA #CDA230  ,https://twitter.com/senrobportman/status/911232034546253824,134,45,79,senrobportman,P000449,R,OH
9597,234435,2017-09-21 22:31:00,Thank you for joining me in listening to the concerns of our #Ohio #SmallBusiness owners! Look forward to continuinäó_  ,https://twitter.com/senrobportman/status/910994809703337984,111,4,5,senrobportman,P000449,R,OH
9598,234436,2017-09-21 22:27:00,I will continue working with my colleagues in Congress & ; the administration to help #Ohioäó»s #smallbusiness owners aäó_  ,https://twitter.com/senrobportman/status/910994001565814786,72,3,6,senrobportman,P000449,R,OH
9599,234437,2017-09-21 22:25:00,"#Ohio is the proud home of more than 900,000 #smallbiz, like the family-owned @Burtonmetal, that employ more than täó_  ",https://twitter.com/senrobportman/status/910993328719753217,46,5,9,senrobportman,P000449,R,OH
9600,234438,2017-09-21 22:21:00,"Gov't should be a partner to these small businesses, not an obstacle to progress by imposing higher taxes and burdeäó_  ",https://twitter.com/senrobportman/status/910992501393231873,68,6,13,senrobportman,P000449,R,OH
9601,234439,2017-09-21 22:19:00,"We heard from #SmallBusiness owners who are facing serious roadblocks to growing their biz, creating more #jobs andäó_  ",https://twitter.com/senrobportman/status/910992006196924416,40,3,9,senrobportman,P000449,R,OH
9602,234440,2017-09-21 22:16:00,Visited @Burtonmetal today for a great visit w/ @SBALinda to hear from #SmallBusiness owners on how we can help.äó_  ,https://twitter.com/senrobportman/status/910991068572864512,27,6,4,senrobportman,P000449,R,OH
9603,234441,2017-09-21 20:38:00,I urge the Senate to act on my bipartisan North Korean Enablers Accountability Act to help accomplish this goal:  ,https://twitter.com/senrobportman/status/910966364067782657,73,10,13,senrobportman,P000449,R,OH
9604,234442,2017-09-21 20:36:00,"It is unacceptable that many Chinese companies continue to do business with #NorthKorea, enabling its dangerous and destabilizing actions.",https://twitter.com/senrobportman/status/910965862819094529,137,21,69,senrobportman,P000449,R,OH
9605,234443,2017-09-21 20:34:00,I strongly support @realDonaldTrump's announcement today on #NorthKorea:  ,https://twitter.com/senrobportman/status/910965551417131010,80,14,33,senrobportman,P000449,R,OH
9606,234444,2017-09-21 19:47:00,Appreciate the work that LifeTown is doing on drug prevention and their work to help disabled kids learn importantäó_  ,https://twitter.com/senrobportman/status/910953765888577536,88,8,23,senrobportman,P000449,R,OH
9607,234445,2017-09-21 19:41:00,Today is the beginning of the yr 5778 on the Jewish calendar and a time of reflection & ; spiritual renewal  ,https://twitter.com/senrobportman/status/910952112904863746,62,11,36,senrobportman,P000449,R,OH
9608,234446,2017-09-21 19:36:00,Honored to visit the Chabad Center on a day of such great meaning to the Jewish people. #RoshHashanah  ,https://twitter.com/senrobportman/status/910950792332488705,26,2,18,senrobportman,P000449,R,OH
9609,234447,2017-09-21 14:45:00,We must continue our work to reduce substance abuse among #Ohio's youth. Drug-Free Communities Program is helping: ,https://twitter.com/senrobportman/status/910877530810236928,196,11,30,senrobportman,P000449,R,OH
9610,234448,2017-09-21 14:31:00,Pleased that 27 new grants through the Drug-Free Communities program are on their way to help #Ohio:   #opioidcrisis,https://twitter.com/senrobportman/status/910874006978301953,75,6,13,senrobportman,P000449,R,OH
9611,234449,2017-09-21 14:24:00,"Drug-Free Communities program is proven to work. Sadly, amidst today's #opioidcrisis, it's needed now more than ever: ",https://twitter.com/senrobportman/status/910872295215902720,152,8,15,senrobportman,P000449,R,OH
9612,234450,2017-09-20 20:37:00,"#Ohio workers deserve a fair shake against unfair trade practices. W/ level playing field, they can compete w anyone: ",https://twitter.com/senrobportman/status/910603724858335232,207,5,21,senrobportman,P000449,R,OH
9613,234451,2017-09-20 20:31:00,".@WhirlpoolCorp in Clyde, #Ohio is the backbone of local economy. Proud to stand w them & ; against unfair trade:  #Jobs",https://twitter.com/senrobportman/status/910602218348453889,46,5,14,senrobportman,P000449,R,OH
9614,234452,2017-09-20 20:10:00,Strong bipartisan consensus emerging that Congress pass #SESTA. Good recap from yesterdayäó»s @SenateCommerce hrg here: ,https://twitter.com/senrobportman/status/910597077935300609,62,6,16,senrobportman,P000449,R,OH
9615,234453,2017-09-20 18:56:00,Congress must act on #SESTA to make sure what happened to Desiree Robinson doesn't happen again. ,https://twitter.com/senrobportman/status/910578305904001024,55,11,19,senrobportman,P000449,R,OH
9616,234454,2017-09-20 18:50:00,Jane & ; I are praying for everyone in Puerto Rico and all those in the path of #HurricaneMaria.,https://twitter.com/senrobportman/status/910576975646986240,89,13,68,senrobportman,P000449,R,OH
9617,234455,2017-09-20 17:45:00,"At yesterdayäó»s @SenateCommerce hrg, there was bipartisan consensus that Congress must pass #SESTA to help #EndHumanTraficking. #CDA230",https://twitter.com/senrobportman/status/910560439557165058,74,6,18,senrobportman,P000449,R,OH
9618,234456,2017-09-20 17:39:00,"#HumanTrafficking is a stain on our national character. #SESTA is a common-sense, bipartisan bill that will help toäó_  ",https://twitter.com/senrobportman/status/910558942144585728,82,31,41,senrobportman,P000449,R,OH
9619,234457,2017-09-20 17:01:00,Jane & ; I wish a happy and healthy New Year to all those in #Ohio & ; around the world observing Rosh Hashana. Shana Tova!,https://twitter.com/senrobportman/status/910549369308532736,111,10,56,senrobportman,P000449,R,OH
9620,234458,2017-09-20 16:34:00,Yvonne Ambrose's testimony yesterday was heartbreaking - but it needs to be heard. Victims of trafficking deserve jäó_  ,https://twitter.com/senrobportman/status/910542713292034048,80,50,77,senrobportman,P000449,R,OH
9621,234459,2017-09-19 20:46:00,Important that U.S. goväó»t take on unfair trade in order to boost the steel industry and protect #jobs:   #Ohio,https://twitter.com/senrobportman/status/910243607558451200,206,11,25,senrobportman,P000449,R,OH
9622,234460,2017-09-19 19:57:00,Congress should come together in bipartisan way to extend #PerkinsLoan program to help students pursue their dreams: ,https://twitter.com/senrobportman/status/910231268880613377,177,14,52,senrobportman,P000449,R,OH
9623,234461,2017-09-19 19:24:00,"  @SenatorLankford: Heartbreaking testimony, but very important to hear. Thank you Yvonne for showing us why Congress must pass #SESTA.häó_",https://twitter.com/senrobportman/status/910223191896928257,32,37,57,senrobportman,P000449,R,OH
9624,234462,2017-09-19 19:17:00,Toledo's @180thFW is critical to our nat'l defense. Proud to have secured $15M in funding to help secure new hangars: ,https://twitter.com/senrobportman/status/910221205000552448,58,4,9,senrobportman,P000449,R,OH
9625,234463,2017-09-19 19:10:00,#Ohio is home to some of the best & ; brightest serving our country. Proud to support many of their initiatives:  #NDAA,https://twitter.com/senrobportman/status/910219442361118720,66,3,7,senrobportman,P000449,R,OH
9626,234464,2017-09-19 17:59:00,"  @SharedHope: ""Sex trafficking is a stain on our country's character."" - @senrobportman  ",https://twitter.com/senrobportman/status/910201602887356416,42,52,76,senrobportman,P000449,R,OH
9627,234465,2017-09-19 17:56:00,  @SharedHope: I am the mother of the late Desiree Robinson and I am asking the Senate to amend the CDA. - Ms. Ambrose #ListentoSurvivorsäó_,https://twitter.com/senrobportman/status/910200925029044225,7,14,20,senrobportman,P000449,R,OH
9628,234466,2017-09-19 17:55:00,  @rights4girls: Thank you @senrobportman for your unwavering support for survivors of sex trafficking & ; your leadership on this criticaläó_,https://twitter.com/senrobportman/status/910200740966207488,8,14,27,senrobportman,P000449,R,OH
9629,234467,2017-09-19 17:54:00,  @GLFOP: FOP is a proud supporter of this bill. We must get justice for the victims of human trafficking and hold those accountable for häó_,https://twitter.com/senrobportman/status/910200373465567234,6,40,68,senrobportman,P000449,R,OH
9630,234468,2017-09-19 17:35:00,Yvonne has a simple request to us here in Congress: Pass #SESTA so what happened to her daughter never happens agaiäó_  ,https://twitter.com/senrobportman/status/910195550162522112,47,29,37,senrobportman,P000449,R,OH
9631,234469,2017-09-19 17:20:00,"""This is not a race, gender or economic problem, this is a people problem, a human problem."" #EndHumanTraffickingäó_  ",https://twitter.com/senrobportman/status/910191773250502656,41,58,97,senrobportman,P000449,R,OH
9632,234470,2017-09-19 17:08:00,The sex trafficking of children like Desiree should not be happening in our country. Her story shows why #SESTA isäó_  ,https://twitter.com/senrobportman/status/910188757785100289,31,14,28,senrobportman,P000449,R,OH
9633,234471,2017-09-19 16:56:00,"MUST WATCH: Yvonne Ambrose tells tragic story of her daughter, Desiree, who was trafficked on #Backpage.  ",https://twitter.com/senrobportman/status/910185733222129664,269,182,192,senrobportman,P000449,R,OH
9634,234472,2017-09-19 16:48:00,Congress can fix the injustice of online sex trafficking. We have a duty to act. #SESTA #EndHumanTrafficking  ,https://twitter.com/senrobportman/status/910183711664087040,38,16,30,senrobportman,P000449,R,OH
9635,234473,2017-09-19 16:38:00,That instances of #humantrafficking & ; sex trafficking are actually increasing in this country is an outrage. My tesäó_  ,https://twitter.com/senrobportman/status/910181269543297029,64,103,144,senrobportman,P000449,R,OH
9636,234474,2017-09-19 14:36:00,  @SharedHope: Starting Now!  Watch here &gt;   #SESTA #ListentoSurvivors  ,https://twitter.com/senrobportman/status/910150526544826370,2,10,19,senrobportman,P000449,R,OH
9637,234475,2017-09-19 14:30:00,Happening Now: Senate hearing on bipartisan Stop Enabling Sex Traffickers Act (#SESTA):  ,https://twitter.com/senrobportman/status/910148988040548353,63,12,19,senrobportman,P000449,R,OH
9638,234476,2017-09-19 14:20:00,Proud to have the support of @Disney for the bipartisan bill to #endhumantrafficking. Their letter here:   #SESTA,https://twitter.com/senrobportman/status/910146561774112768,21,7,16,senrobportman,P000449,R,OH
9639,234477,2017-09-19 14:06:00,My op-ed in the @guardian details why #SESTA is needed. Please read and share:   #EndHumanTrafficking #CDA230,https://twitter.com/senrobportman/status/910142938730156037,25,13,12,senrobportman,P000449,R,OH
9640,234478,2017-09-19 13:50:00,History will judge those who don't help to stop #humantrafficking. This crime is a stain on our national character - and it must stop.#SESTA,https://twitter.com/senrobportman/status/910138910629437441,238,76,139,senrobportman,P000449,R,OH
9641,234479,2017-09-19 13:37:00,#SESTA will also help get victims of #humantrafficking the justice they deserve. Justice that is long overdue.  ,https://twitter.com/senrobportman/status/910135641643585536,32,19,31,senrobportman,P000449,R,OH
9642,234480,2017-09-19 13:25:00,#SESTA is designed to hold accountable companies like #Backpage that knowingly facilitate the trafficking of womenäó_  ,https://twitter.com/senrobportman/status/910132638542942209,28,25,34,senrobportman,P000449,R,OH
9643,234481,2017-09-19 13:11:00,"I will be testifying along w/ Yvonne Ambrose, a mother whose daughter was trafficked on #Backpage. Her story:   #SESTA",https://twitter.com/senrobportman/status/910129273779912704,26,13,22,senrobportman,P000449,R,OH
9644,234482,2017-09-19 13:03:00,"At 10:30 this morning, the Senate will hold a hearing on the bipartisan bill to #endhumantrafficking:   #SESTA #CDA230",https://twitter.com/senrobportman/status/910127329833291776,57,18,41,senrobportman,P000449,R,OH
9645,234483,2017-09-19 00:52:00,United States must support our allies in #Ukraine. Senate took big step forward today to helping our imp't ally:  ,https://twitter.com/senrobportman/status/909943120317607936,83,9,32,senrobportman,P000449,R,OH
9646,234484,2017-09-19 00:46:00,Important that the United States bolster its defense against foreign propaganda & ; disinformation:   #NDAA #Russia,https://twitter.com/senrobportman/status/909941613576699905,142,20,73,senrobportman,P000449,R,OH
9647,234485,2017-09-19 00:41:00,.@WrightPattAFB is at the cutting-edge of Air Force technology. #NDAA supports WPAFB #jobs & ; research mission: ,https://twitter.com/senrobportman/status/909940353146523648,39,4,16,senrobportman,P000449,R,OH
9648,234486,2017-09-19 00:36:00,Lima builds the best tanks anywhere in the world. #NDAA authorizes funding to increase production. Good for #jobs:  ,https://twitter.com/senrobportman/status/909939095736082432,37,6,15,senrobportman,P000449,R,OH
9649,234487,2017-09-19 00:28:00,#NDAA authorizes $15 million to support construction of new hangars at the @180FW in Toledo:  ,https://twitter.com/senrobportman/status/909937080830091264,20,5,7,senrobportman,P000449,R,OH
9650,234488,2017-09-19 00:24:00,Pleased that the #NDAA includes my priorities that provide necessary resources to #Ohio servicemembers:  ,https://twitter.com/senrobportman/status/909936075946172417,32,5,10,senrobportman,P000449,R,OH
9651,234489,2017-09-19 00:20:00,"Today, the Senate took a big step toward ensuring that our men & ; women in uniform have the resources they need:  #NDAA",https://twitter.com/senrobportman/status/909935151093870593,50,10,23,senrobportman,P000449,R,OH
9652,234490,2017-09-18 23:21:00,Thank you to the Union of Orthodox Jewish Congregations of America for your support of #SESTA:  ,https://twitter.com/senrobportman/status/909920227017789440,21,6,6,senrobportman,P000449,R,OH
9653,234491,2017-09-18 22:17:00,I'm looking forward to testifying tomorrow on the Stop Enabling Sex Traffickers Act. Live stream will be here:  #SESTA,https://twitter.com/senrobportman/status/909904342446219264,81,40,67,senrobportman,P000449,R,OH
