date,nextday_RET,headline,direction
2020-04-29,0.014532,BOEING - ANNOUNCED A LEADERSHIP AND ORGANIZATIONAL RESTRUCTURING TO STREAMLINE ROLES AND RESPONSIBILITIES.,up
2020-04-29,0.014532,BOEING CFO SAYS RIGHT-SIZING BGS BUSINESS TO ADJUST TO MARKET REALITIES.,up
2020-04-29,0.014532,"GE - AS OF MARCH 31, GECAS RECEIVED DEFERRAL REQUESTS (PRIMARILY SHORT TERM IN NATURE) FROM ABOUT 75% OF ITS AIRLINE CUSTOMERS.",up
2020-04-29,0.014532,NYSE ORDER IMBALANCE <BA.N> 80755.0 SHARES ON BUY SIDE,up
2020-04-29,0.014532,BOEING - COULD NOT COME TO A RESOLUTION AROUND CRITICAL UNSATISFIED CONDITIONS FOR EMBRAER DEAL.,up
2020-04-29,0.014532,BOEING - ESTIMATED ABNORMAL PRODUCTION COSTS FROM TEMPORARY SUSPENSION OF 737 MAX PRODUCTION ROSE BY ABOUT $1 BLN DUE TO UPDATED PRODUCTION ASSUMPTIONS.,up
2020-04-29,0.014532,BOEING - EXPLORING POTENTIAL GOVERNMENT FUNDING OPTIONS AND ADVOCATING FOR ACCESS TO CREDIT FOR ENTIRE AEROSPACE MANUFACTURING SUPPLY CHAIN.,up
2020-04-29,0.014532,EXCLUSIVE-Boeing eyes major bond issue to raise funds-sources.,up
2020-04-29,0.014532,"BOEING - HAVE TO MAKE MORE THAN 15% STAFF REDUCTIONS ACROSS COMMERCIAL AIRPLANES AND SERVICES BUSINESSES, AS WELL AS CORPORATE FUNCTIONS.",up
2020-04-29,0.014532,TOP BOEING SHAREHOLDER VANGUARD ALSO BACKED PROPOSAL FOR INDEPENDENT CHAIR - VANGUARD REPORT.,up
2020-04-29,0.014532,"US STOCKS-Futures rise on Alphabet, Boeing earnings ahead of GDP data.",up
2020-04-29,0.014532,BOEING - ACTIVELY EXPLORING ALL OF AVAILABLE OPTIONS FOR ACCESS TO ADDITIONAL LIQUIDITY.,up
2020-04-29,0.014532,BOEING CEO SAYS CONTINUES TO EVALAUTE FUNDING OPTIONS FROM THE U.S. GOVERNEMNT- CONF CALL.,up
2020-04-29,0.014532,"BOEING - Q1 COMMERCIAL AIRPLANES OPER MARGIN DECREASED DUE TO LOWER DELIVERY VOLUME, $797 MLN OF ABNORMAL PRODUCTION COSTS FROM 737 MAX SUSPENSION .",up
2020-04-29,0.014532,UPDATE 1-Top Boeing shareholder Vanguard says it voted against chair Kellner.,up
2020-04-29,0.014532,"BOEING - AT QUARTER-END, BOEING CAPITAL'S NET PORTFOLIO BALANCE WAS $2.2 BLN.",up
2020-04-29,0.014532,Boeing to cut staff by 10% amid coronavirus pandemic.,up
2020-04-29,0.014532,GE - CONTINUE TO EVALUATE STRATEGIC OPTIONS TO ACCELERATE FURTHER REDUCTION IN THE SIZE OF GE CAPITAL.,up
2020-04-29,0.014532,UPDATE 1-Boeing cuts 787 production after second straight quarter of losses.,up
2020-04-29,0.014532,UPDATE 1-Airbus Q1 core profit plunges 49% as coronavirus crisis starts to bite .,up
2020-04-29,0.014532,UPDATE 2-Airbus Q1 profit plunges as coronavirus crisis starts to bite.,up
2020-04-29,0.014532,"BOEING - ""THE AVIATION INDUSTRY WILL TAKE YEARS TO RETURN TO THE LEVELS OF TRAFFIC WE SAW JUST A FEW MONTHS AGO"".",up
2020-04-29,0.014532,BOEING - PRODUCTION RATE ASSUMPTIONS HAVE NOT CHANGED ON 767 AND 747 PROGRAMS.,up
2020-04-29,0.014532,BOEING - PLANS TO REDUCE OVERALL STAFFING LEVELS WITH A VOLUNTARY LAYOFF PROGRAM AND ADDITIONAL WORKFORCE ACTIONS AS NECESSARY.,up
2020-04-29,0.014532,"BOEING CEO SAYS BELIEVES THE 'THAW IS BEGINNING', SEES 3-5 YEAR INDUSTRY RECOVERY.",up
2020-04-29,0.014532,"BOEING - QTR-END DEBT WAS $38.9 BLN, UP FROM $27.3 BLN AT BEGINNING OF QUARTER.",up
2020-04-29,0.014532,BOEING - TAKING SEVERAL ACTIONS THAT INCLUDE REDUCING COMMERCIAL AIRPLANE PRODUCTION RATES.,up
2020-04-29,0.014532,"BOEING - ""WEтАЩRE ALSO SEEING A DRAMATIC IMPACT ON OUR COMMERCIAL SERVICES BUSINESS, AS GROUNDED AIRLINE FLEETS DECREASE THE DEMAND FOR OUR OFFERINGS"".",up
2020-04-29,0.014532,"BOEING CEO SAYS ""COVID-19 PANDEMIC IS AFFECTING EVERY ASPECT OF OUR BUSINESS, INCLUDING AIRLINE CUSTOMER DEMAND, PRODUCTION CONTINUITY AND SUPPLY CHAIN STABILITY"".",up
2020-04-29,0.014532,BOEING - CURRENTLY PLAN TO RAISE ADDITIONAL LIQUIDITY IN THE SECOND QUARTER .,up
2020-04-29,0.014532,"BUZZ-Southwest Airlines boosts capital raise >50%, reaps $4 bln.",up
2020-04-29,0.014532,BOEING - 777/777X COMBINED PRODUCTION RATE WILL BE REDUCED TO 3 PER MONTH IN 2021.,up
2020-04-29,0.014532,"UPDATE 3-Boeing to cut workforce, seek liquidity as coronavirus leads to quarterly loss .",up
2020-04-29,0.014532,BOEING CEO SAYS HAVING CONVERSATION WITH MAX CUSTOMERS ABOUT DELIVERY TIMELINES AND SOME WANT TO DEFER THEM FOR QUITE A WHILE.,up
2020-04-29,0.014532,"BOEING - AS PANDEMIC CONTINUES TO REDUCE AIRLINE PASSENGER TRAFFIC, CO SEES SIGNIFICANT IMPACT ON DEMAND FOR NEW COMMERCIAL AIRPLANES AND SERVICES.",up
2020-04-29,0.014532,"AIRBUS CEO SAYS COLLAPSE OF BOEING-EMBRAER DEAL IS COLLATERAL DAMAGE FOR COMPETITORS, MORE POSITIVE FOR AIRBUS.",up
2020-04-29,0.014532,Top Boeing shareholder Vanguard says it voted against chair Kellner.,up
2020-04-29,0.014532,BOEING CFO SAYS SAW DECREASE IN COMMERCIAL VOLUME IN BGS IN Q1 DUE TO COVID-19; EXPECTS SIGNIFICANTLY LARGER IMPACT IN FUTURE PERIODS.,up
2020-04-29,0.014532,BOEING CFO SAYS WILL DEFER R&D AND CAPEX BUT CONTINUE SPENDING ON KEY PRIORITIES.,up
2020-04-29,0.014532,"BOEING CEO SAYS EXPECTS AIRLINE FLEET RATIONALIZATION EFFORTS WILL GET BIG, AND NEW AIRCRAFT WILL BE ORDERED TO REPLACE OLD ONES THAT ARE RETIRING.",up
2020-04-29,0.014532,BOEING CFO ASSUMES 737 MAX OUTPUT BEGINS AT LOW RATES IN Q2 .,up
2020-04-29,0.014532,BOEING CEO SAYS THE JOB CUTS WILL BE COMPLETED BY END OF YEAR .,up
2020-04-29,0.014532,BOEING - ESTIMATED ABNORMAL PRODUCTION COSTS FROM TEMPORARY SUSPENSION OF 737 MAX PRODUCTION HAVE INCREASED BY APPROXIMATELY $1 BLN.,up
2020-04-29,0.014532,"BOEING CEO, IN LETTER TO EMPLOYEES, SAYS NEW REDUCTIONS IN PRODUCTION RATES AND CONTINUED IMPACT OF COVID-19 ON BUSINESS WILL FORCE CO TO REDUCE SIZE OF WORKFORCE.",up
2020-04-29,0.014532,UPDATE 5-Boeing to shrink workforce and production as coronavirus slams industry.,up
2020-04-29,0.014532,BOEING CEO ON COMPETITION WITH AIRBUS тАУ SAYS NOT OUT OF THE PRODUCTION DEVELOPMENT BUSINESS.,up
2020-04-29,0.014532,UPDATE 4-Boeing to cut workforce and production as it braces for years-long industry recovery  .,up
2020-04-29,0.014532,"BOEING CEO SAYS ""WE ARE NOT OUT OF THE PRODUCT DEVELOPMENT BUSINESS"".",up
2020-04-29,0.014532,BOEING - MAKING CHANGES TO START RESTRUCTURING FROM THE TOP .,up
2020-04-29,0.014532,BOEING CEO SAYS BELIEVES THAT REGULATORY APPROVALS WILL BE IN PLACE TO RESUME 737 MAX DELIVERY IN Q3.,up
2020-04-29,0.014532,UPDATE 2-AirAsia to halt Airbus deliveries and review orders .,up
2020-04-29,0.014532,"GE - AS OF MARCH 31, HAVE ABOUT $2.5 BLN OF NET ASSETS ($4.8 BLN OF ASSETS & $2.3 BLN OF LIABILITIES) RELATED TO 737 MAX PROGRAM.",up
2020-04-29,0.014532,"BRIEF-Boeing CEO Says Believes The 'Thaw Is Beginning', Sees 3-5 Year Industry Recovery -CNBC Interview.",up
2020-04-29,0.014532,"BOEING - COMMERCIAL AIRPLANES DELIVERED 50 AIRPLANES DURING QUARTER, INCLUDING 29 787S.",up
2020-04-29,0.014532,BOEING CEO SAYS 2500 AIRCRAFT OVER 25 YEARS OLD WERE IN SERVICE BEFORE CRISIS.,up
2020-04-29,0.014532,RPT-BUZZ-PREVIEW: Boeing rises ahead of expected Q1 loss .,up
2020-04-29,0.014532,PRESS DIGEST -Wall Street Journal - April 29.,up
2020-04-29,0.014532,BOEING SHARES UP ABOUT 3.6% PREMARKET AFTER RESULTS.,up
2020-04-29,0.014532,BRIEF-Boeing Reports Q1 Revenue Of $16.9 Bln .,up
2020-04-30,-0.054248,Moody's downgrades Embraer ratings to Ba2; outlook negative.,down
2020-04-30,-0.054248,PRESS DIGEST- New York Times business news - April 30.,down
2020-04-30,-0.054248,"U.S. RESEARCH ROUNDUP- Labcorp, ServiceNow, Zebra Technologies.",down
2020-04-30,-0.054248,MERCADOS GLOBAIS-A├з├╡es sobem com esperan├зas sobre tratamento para Covid-19; petr├│leo salta.,down
2020-04-30,-0.054248,"BRIEF-All Nippon Airways Will Delay Delivery Of Aircraft, Says President & CEO Shinya Katanozaka - Nikkei.",down
2020-04-30,-0.054248,"BUZZ-Boeing: Seen raising as much as $25 bln, says tweet; shares rise.",down
2020-04-30,-0.054248,BOEING <BA.N>: CFRA CUTS TARGET PRICE TO $112 FROM $216 .,down
2020-04-30,-0.054248,"UPDATE 1-Musk's SpaceX, Bezos' Blue Origin land contracts to build NASA's astronaut moon lander.",down
2020-04-30,-0.054248,"S&P SAYS BOEING CO DOWNGRADED TO 'BBB-/A-3' FROM 'BBB/A-2' ON CORONAVIRUS IMPACT, OUTLOOK STABLE .",down
2020-04-30,-0.054248,"S&P SAYS BOEING'S EARNINGS, CASH FLOW OVER NEXT FEW YEARS LIKELY TO BE LOWER THAN EXPECTED DUE TO IMPACT OF CORONAVIRUS ON AIRCRAFT DEMAND.",down
2020-04-30,-0.054248,"EMPLOYEE FURLOUGHS WILL GRANT ABOUT 1 BILLION YEN IN MONTHLY COST REDUCTION BENEFITS GROUPWIDE, SAYS ANA CEO - NIKKEI .",down
2020-04-30,-0.054248,Fitch Rates Boeing's Senior Notes 'BBB'.,down
2020-04-30,-0.054248,S&P SAYS STABLE OUTLOOK FOR BOEING REFLECTS CREDIT RATIOS THAT SHOULD IMPROVE IN 2021 DUE TO HIGHER 737 MAX DELIVERIES.,down
2020-04-30,-0.054248,"S&P lowers Boeing's credit rating on coronavirus hit to earnings, cash flow.",down
2020-04-30,-0.054248,S&P SAYS BOEING CO.'S EARNINGS AND CASH FLOW OVER NEXT FEW YEARS ARE LIKELY TO BE LOWER THAN S&P HAD PREVIOUSLY EXPECTED.,down
2020-04-30,-0.054248,S&P SAYS REMOVING BOEING RATINGS FROM CREDITWATCH.,down
2020-04-30,-0.054248,S&P ASSIGNS 'STABLE' OUTLOOK ON BOEING.,down
2020-04-30,-0.054248,S&P ASSIGNS BBB- RATING ON BOEING'S FOREIGN CURRENCY LT AND LOCAL CURRENCY LT FROM BBB.,down
2020-04-30,-0.054248,"UPDATE 2-Musk's SpaceX, Bezos' Blue Origin land contracts to build NASA's astronaut moon lander.",down
2020-04-30,-0.054248,NYSE ORDER IMBALANCE <BA.N> 65729.0 SHARES ON BUY SIDE,down
2020-04-30,-0.054248,FITCH RATES BOEING'S SENIOR NOTES 'BBB'.,down
2020-04-30,-0.054248,"AIRCRAFT DUE FOR DELIVERY IN H2 OF CURRENT FISCAL YEAR WILL BE SHIFTED TO NEXT FISCAL YEAR, SAYS ANA CEO - NIKKEI.",down
2020-04-30,-0.054248,BRIEF-S&P Says Boeing's Proposed Senior Unsecured Notes Rated 'BBB-'.,down
2020-04-30,-0.054248,Embraer and Boeing's $4.2 bln deal ruled out pandemic as pretext to cancel.,down
2020-04-30,-0.054248,U.S. State Department approves possible attack helicopter sale to Philippines.,down
2020-04-30,-0.054248,"UPDATE 7-Boeing to shrink workforce, raise cash as coronavirus slams jet industry.",down
2020-04-30,-0.054248,MOODY'S ASSIGNS BAA2 RATINGS TO BOEING'S NEW UNSECURED NOTES.,down
2020-04-30,-0.054248,S&P SAYS U.S.-BASED AIRCRAFT MANUFACTURER AND DEFENSE CONTRACTOR BOEING CO.'S PROPOSED SENIOR UNSECURED NOTES RATED 'BBB-'.,down
2020-04-30,-0.054248,BOEING <BA.N> : BOFA GLOBAL RESEARCH RAISES PRICE OBJECTIVE TO $160 FROM $135.,down
2020-04-30,-0.054248,BOEING <BA.N>: CREDIT SUISSE CUTS PRICE TARGET TO $173 FROM $187.,down
2020-04-30,-0.054248,"FORESEE DOMESTIC FLIGHTS AT 2020 FISCAL YEAR END BEING 70% VS A YEAR EARLIER, & 50% FOR INTERNATIONAL FLIGHTS AT THE LOW END, SAYS ANA CEO - NIKKEI.",down
2020-04-30,-0.054248,S&P ASSIGNS 'A-3' RATING ON BOEING'S FOREIGN CURRENCY ST AND LOCAL CURRENCY ST FROM 'A-2'.,down
2020-04-30,-0.054248,UPDATE 1-Crisis-torn airlines scramble to convert empty cabins to cargo.,down
2020-04-30,-0.054248,"ALL NIPPON AIRWAYS WILL DELAY DELIVERY OF AIRCRAFT, SAYS PRESIDENT AND CEO SHINYA KATANOZAKA - NIKKEI.",down
2020-04-30,-0.054248,"BRIEF-S&P Says Boeing Co. Downgraded To 'BBB-/A-3' From 'BBB/A-2' On Coronavirus Impact, Outlook Stable.",down
2020-04-30,-0.054248,Crisis-torn airlines scramble to convert empty cabins to cargo .,down
2020-04-30,-0.054248,"BOEING FILES FOR SEVEN-PART NOTES OFFERING, AMOUNT NOT DISCLOSED - SEC FILING.",down
2020-04-30,-0.054248,BUZZ-Boeing gains on IFR report of bond offering demand rising to $57bn.,down
2020-04-30,-0.054248,BRIEF-S&P Says Boeing Downgraded To 'BBB-/A-3' On Coronavirus Impact.,down
2020-04-30,-0.054248,MOODY'S DOWNGRADES EMBRAER RATINGS TO BA2; OUTLOOK NEGATIVE.,down
2020-04-30,-0.054248,"S&P SAYS BOEING CO. DOWNGRADED TO 'BBB-/A-3' FROM 'BBB/A-2' ON CORONAVIRUS IMPACT, OUTLOOK STABLE.",down
2020-04-30,-0.054248,"AMERICAN AIRLINES STICKING WITH JET DELIVERY SCHEDULE, WILL REDUCE FLEET THROUGH EARLY RETIREMENTS RATHER THAN DELIVERY DEFERRALS -CEO.",down
2020-04-30,-0.054248,BUZZ-Street View: Boeing's take off could take longer than it anticipates.,down
2020-05-01,-0.014321,"BRIEF-Ryanair grounds most flights until July, says reviewing growth plans.",down
2020-05-01,-0.014321,"RYANAIR CEO: I STILL THINK BOUNCE-BACK IN JULY-SEPT WILL BE STRONG IN VOLUME TERMS; SEES 40% OF NORMAL CAPACITY IN JULY, 60% IN AUGUST.",down
2020-05-01,-0.014321,"EMBRAER COMMERCIAL CEO SAYS THERE WAS PAIN IN CARVING OUT COMMERCIAL UNIT FOR BOEING MERGER, THERE IS DUPLICATION WITH CORE EMBRAER.",down
2020-05-01,-0.014321,NYSE ORDER IMBALANCE <BA.N> 61976.0 SHARES ON SELL SIDE,down
2020-05-01,-0.014321,Boeing set to raise $25 bln in massive debt sale -sources.,down
2020-05-01,-0.014321,SECOND BOEING 777X COMPLETES FIRST FLIGHT.,down
2020-05-01,-0.014321,"EMBRAER <EMBR3.SA> COMMERCIAL AVIATION CEO SAYS WAS CONVINCED BOEING TIE-UP WOULD PROVIDE EXTRAORDINARY BENEFITS TO CUSTOMERS, NO OVERLAP IN PORTFOLIO.",down
2020-05-01,-0.014321,"EMBRAER COMMERCIAL CEO, ASKED ABOUT POTENTIAL NEW PARTNERSHIPS, SAYS CANNOT LEGISLATE FOR INBOUND CALLS.",down
2020-05-01,-0.014321,"BOEING - ALSO FILES FOR OFFERING OF $5.5 BLN 5.805% SENIOR NOTES DUE 2050, $3.5 BLN 5.930% SENIOR NOTES DUE 2060.",down
2020-05-01,-0.014321,"BOEING SECURES $25 BLN IN FUNDING WITH ISSUE OF BONDS WITH WIDE RANGE OF MATURITIES- CNBC'S DAVID FABER, CITING SOURCES.",down
2020-05-01,-0.014321,RYANAIR CEO:  SAYS IN ADVANCED STAGE OF TALKS ON COMPREHENSIVE AGREEMENT WITH BOEING; DEADLINE MAY 18-19.,down
2020-05-01,-0.014321,EMBRAER COMMERCIAL CEO SAYS HARD TO CONSIDER LAUNCHING NEW AIRCRAFT PROGRAMME IN THIS ENVIRONMENT.,down
2020-05-01,-0.014321,RYANAIR CEO:  WE WILL ALSO LOST MONEY IN Q2; INEVITABLE THAT THIS YEAR WE WILL MAKE A SMALL LOSS.,down
2020-05-01,-0.014321,BOEING - ALSO LOOKING AT MUCH SMALLER REDUCTIONS ELSEWHERE IN AUSTRALIA AND NEW ZEALAND.,down
2020-05-01,-0.014321,RPT-RYANAIR CEO:  WE WILL ALSO LOSE MONEY IN Q2; INEVITABLE THAT THIS YEAR WE WILL MAKE A SMALL LOSS.,down
2020-05-01,-0.014321,Ryanair in advanced talks over possible new Boeing order.,down
2020-05-01,-0.014321,INTERVIEW-Ryanair threatens to shut Lauda's main base in Vienna - O'Leary.,down
2020-05-01,-0.014321,RYANAIR CEO:  THINKS MAX WILL BE BACK FLYING IN JULY OR AUGUST.,down
2020-05-01,-0.014321,"EMBRAER COMMERCIAL CEO SAYS WILL GET THROUGH TURBULENCE AHEAD, FOCUS ON DEALING WITH CUSTOMERS.",down
2020-05-01,-0.014321,RYANAIR CEO:  WILL ULTIMATELY RETURN TO ORIGINAL GROWTH PLANS; WILL EMERGE FROM CRISIS STRONGER THAN EVER.,down
2020-05-01,-0.014321,RYANAIR CEO:  MAY TAKE A YEAR OR TWO TO OVERTURN STATE AID ACROSS EUROPE AT WHICH STAGE MUCH OF DAMAGE WILL BE DONE.,down
2020-05-01,-0.014321,BOEING -  BOEING DEFENCE AUSTRALIA AND INSITU PACIFIC NOT IMPACTED BY CURRENT REDUNDANCY PROCESS.,down
2020-05-01,-0.014321,"RYANAIR CEO:  SAYS VERY OPTIMISTIC THAT WE HAVE SOME 737 MAX JETS NEXT SUMMER, QUESTION IS WHETHER WE HAVE 30 OR 10.",down
2020-05-01,-0.014321,RYANAIR CEO:  'WE ARE SEEING WHETHER WE WILL DELAY OR CANCEL SOME OF THOSE [AIRCRAFT] ORDERS' TO RIGHT-SIZE AIRLINE FOR NEXT YEAR OR 2.,down
2020-05-01,-0.014321,BOEING - CONDUCTED A PRODUCTIVE AND SUCCESSFUL FIRST FLIGHT OF SECOND 777X AIRPLANE.,down
2020-05-01,-0.014321,INTERVIEW-Ryanair sets mid-May deadline for talks on new Boeing MAX order.,down
2020-05-01,-0.014321,UNITED AIRLINES SAYS DISCUSSING WITH BOEING TIMING OF REMAINING 737 MAX DELIVERIES AFTER 2021; WON'T TAKE ANY AIRCRAFT IT DOESN'T NEED.,down
2020-05-01,-0.014321,RYANAIR CEO   LAUDA UNIONS HAVE TO MAY 20 TO ACCEPT PAY CUTS AND NEW CLA; OTHERWISE WILL REPLACE VIENNA A320 BASE WITH RYANAIR PLANES.,down
2020-05-01,-0.014321,UNITED AIRLINES EXEC SAYS EXPECTS TO TAKE DELIVERY OF EIGHT 787-10 AIRCRAFT NEXT YEAR.,down
2020-05-01,-0.014321,"United sees Q3 daily cash burn under $40 mln, still taking jet deliveries.",down
2020-05-01,-0.014321,"CORRECTED-UPDATE 3-Musk's SpaceX, Bezos' Blue Origin land contracts to build NASA's astronaut moon lander.",down
2020-05-01,-0.014321,BOEING <BA.N>: JP MORGAN RAISES PRICE TARGET TO $158 FROM $130.,down
2020-05-01,-0.014321,BOEING - BDA CONTINUES TO GROW ITS DEFENCE SYSTEMS & SERVICES PORTFOLIO & PLANS TO FILL ABOUT 170 OPEN POSITIONS.,down
2020-05-01,-0.014321,"Ryanair grounds virtually all planes until July, reviews growth plans.",down
2020-05-01,-0.014321,"UNITED AIRLINES SAYS IF 737 MAX IS UNGROUNDED, CO TO TAKE DELIVERY OF 16 AIRCRAFT THIS YEAR, 24 NEXT YEAR.",down
2020-05-01,-0.014321,RYANAIR CEO:  SAYS PRICING AND POSSIBLE CANCELLATION OF MAX ORDERS IS PART OF THE DISCUSSION.,down
2020-05-01,-0.014321,South African trade unions seek court action over job cuts at SAA.,down
2020-05-01,-0.014321,BRIEF-Boeing Initiates Redundancy Of About 230 Positions At Its Aerostructures Australia Facility.,down
2020-05-01,-0.014321,"UPDATE 2-Ryanair boss decries 'state aid doping' as airline sheds 3,000 jobs .",down
2020-05-01,-0.014321,BOEING SAYS DO NOT PLAN TO SEEK ADDITIONAL FUNDING THROUGH THE CAPITAL MARKETS OR THE U.S. GOVERNMENT OPTIONS AT THIS TIME.,down
2020-05-01,-0.014321,BOEING FILES FOR OFFERING OF $3 BLN 4.508% SENIOR NOTES DUE 2023 - SEC FILING .,down
2020-05-01,-0.014321,BOEING - INITIATING CONSULTATION AND REDUNDANCY PROCESSES FOR ABOUT 230 POSITIONS AT ITS BOEING AEROSTRUCTURES AUSTRALIA FACILITY .,down
2020-05-01,-0.014321,BRIEF-Second Boeing 777X Completes First Flight.,down
2020-05-01,-0.014321,RYANAIR CEO:  SAYS MAIN ISSUES ARE TIMING OF MAX DELIVERY AND TAKING A NEW AIRCRAFT ORDER.,down
2020-05-01,-0.014321,RYANAIR CEO:  BOND FUND RAISING OVERNIGHT 'REMOVES ANY DOUBTS OVER BOEING'S SURVIVABILITY' .,down
2020-05-01,-0.014321,"BOEING - ALSO FILES FOR OFFERING OF $3.5 BLN 4.875% SENIOR NOTES DUE 2025, $2 BLN 5.040% SENIOR NOTES DUE 2027.",down
2020-05-01,-0.014321,UNITED AIRLINES EXEC SAYS EXPECTS TO TAKE DELIVERY OF 8 MORE 787-9 AIRCRAFT THIS YEAR.,down
2020-05-01,-0.014321,"UPDATE 1-Ryanair to cut 3,000 jobs as the coronavirus crisis drags on.",down
2020-05-01,-0.014321,"EMBRAER COMMERCIAL CEO SAYS BURNING MORE CASH BUT ABLE TO RAISE MORE IF NEEDED, NOT CONCERNED ABOUT LIQUIDITY.",down
2020-05-01,-0.014321,EMBRAER COMMERCIAL CEO SAYS CUSTOMERS DISAPPOIONTED TRANSACTION DID NOT MATERIALIZE.,down
2020-05-01,-0.014321,RPT-RYANAIR CEO: WE CAN SURVIVE THIS FOR CERTAINLY 12 MONTHS; WE WILL SURVIVE THIS BUT WITH VERY LITTLE CASH LEFT.,down
2020-05-01,-0.014321,"BOEING - ALSO FILES FOR OFFERING OF $4.5 BLN 5.150% SENIOR NOTES DUE 2030, $3 BLN 5.705% SENIOR NOTES DUE 2040.",down
2020-05-01,-0.014321,BRIEF-Ryanair CEO says may cancel some aircraft orders; sees FY loss.,down
2020-05-01,-0.014321,"UPDATE 2-Boeing raises $25 billion in blowout debt sale, eschews government aid.",down
2020-05-01,-0.014321,Boeing says will not seek further funds from U.S. govt.,down
2020-05-01,-0.014321,"UPDATE 1-Embraer suffered ""pain"" in preparing Boeing deal - commercial head.",down
2020-05-01,-0.014321,"UPDATE 3-Musk's SpaceX, Bezos' Blue Origin land contracts to build NASA's astronaut moon lander.",down
2020-05-01,-0.014321,RYANAIR CEO:  SAYS EXPECTS LOAD FACTORS OF AROUND 50-60% IN JULY AND AUGUST.,down
2020-05-01,-0.014321,TIMELINE-Norwegian Air's battle for survival.,down
2020-05-01,-0.014321,RYANAIR CEO:  RECOVERY WILL BE 'ANEMIC ENOUGH' IN JULY-SEPTEMBER .,down
2020-05-01,-0.014321,"UPDATE 2-Jetmaker Embraer focuses on future after Boeing divorce ""pain"".",down
2020-05-01,-0.014321,RYANAIR CDO: WE CAN SURVIVE THIS FOR CERTAINLY 12 MONTHS; WE WILL SURVIVE THIS BUT WITH VERY LITTLE CASH LEFT.,down
2020-05-01,-0.014321,PRESS DIGEST -Wall Street Journal - May 1.,down
2020-05-01,-0.014321,UPDATE 1-Boeing raises $25 bln in blowout debt sale.,down
2020-05-01,-0.014321,RYANAIR CEO:  SEES LOAD FACTORS OVER 90% RETURNING FOR RYANAIR IN SUMMER OF 2021.,down
2020-05-01,-0.014321,BOEING <BA.N>: CREDIT SUISSE CUTS TARGET PRICE TO $156 FROM $173.,down
2020-05-01,-0.014321,"Embraer suffered ""pain"" in preparing Boeing deal -commercial head.",down
2020-05-01,-0.014321,"EMBRAER <EMBR3.SA> COMMERCIAL CEO SAYS ""THERE HAS BEEN NO OUTREACH BY EMBRAER TO ANYONE"" AFTER BOEING DEAL COLLAPSE.",down
2020-05-01,-0.014321,UNITED PRESIDENT SAYS NO CURRENT PLANS TO CLOSE HUBS BUT 'EVERYTHING IS ON THE TABLE' -CONF CALL.,down
2020-05-04,-0.046098,BUZZ-Airline stocks plunge after Buffett gets rid of stakes; Boeing down 4%.,down
2020-05-04,-0.046098,BRAZIL'S GOL SAYS IT WILL RECEIVE A CASH EFFECT OF 447 MLN REAIS IN Q2 AS COMPENSATION FOR THE GROUNDING OF THE BOEING 737 MAX .,down
2020-05-04,-0.046098,BRAZIL'S GOL SAYS BOEING HAS PAID $100 MLN IN COMPENSATION FOR MAX DELAYS AND MORE CASH IS EXPECTED -CFO.,down
2020-05-04,-0.046098,TIMELINE-Fasten seatbelts: Norwegian Air's battle for survival.,down
2020-05-04,-0.046098,BUZZ-Virgin Galactic descends as co files 150 mln share offering by holders.,down
2020-05-04,-0.046098,"BRAZIL'S GOL SAYS THERE IS A ""MEANINGFUL"" INCREASE IN DEMAND FOR AIR TRAVEL FOR THE NEXT FOUR WEEKS COMPARED TO A WEEK AGO -CEO",down
2020-05-04,-0.046098,UPDATE 1-Brazil airline Gol says it has enough cash to run until the end of the year.,down
2020-05-04,-0.046098,AIRLINE GOL SAYS BRAZIL'S BNDES STATE BANK HAS SET A MAY 15 DEADLINE FOR IMPLEMENTING LOAN AID TO CARRIERS -CEO.,down
2020-05-04,-0.046098,BRAZIL'S GOL SAYS 8 EMPLOYEES HAVE CORONAVIRUS -CEO.,down
2020-05-04,-0.046098,BRAZIL'S GOL SAYS IT HAS 4 BLN REAIS IN TOTAL LIQUIDITY AND 2 BLN REAIS IN AVAILABLE CASH -CFO.,down
2020-05-04,-0.046098,"UPDATE 1-GE Aviation to cut workforce by up to 13,000 jobs, or 25%.",down
2020-05-04,-0.046098,Brazil airline Gol posts $420 mln loss due to weaker currency.,down
2020-05-04,-0.046098,"BRAZIL'S GOL SAYS AID FROM BNDES HAS A ""REASONABLE COST"" BUT CO IS ""SENSITIVE TO DILLUTION"" -CFO.",down
2020-05-04,-0.046098,"BRAZIL'S GOL EXPECTS LIQUIDITY TO STAY THE SAME AT THE END OF Q2, BOOSTED BY BOEING PAYMENTS RELATED TO THE MAX GROUNDING -CFO.",down
2020-05-04,-0.046098,BUZZ-Aerospace & Defence: Berenberg does not see through to a new normal  .,down
2020-05-05,-0.02823,UPDATE 2-Lufthansa to pay no dividend for 2019 as airline seeks bailout,down
2020-05-05,-0.02823,AERCAP HOLDINGS NV - EXPECT ADDITIONAL BOEING 737 MAX LEASES TO BE CANCELLED IN FUTURE.,down
2020-05-05,-0.02823,"ROYAL AUSTRALIAN AIR FORCE AIR VICE-MARSHAL SAYS US, UK ARE ALSO INTERESTED IN BOEING LOYAL WINGMAN UNMANNED FIGHTER.",down
2020-05-05,-0.02823,Boeing could produce Loyal Wingman fighter-like drone by middle of decade -exec.,down
2020-05-05,-0.02823,"AERCAP CEO SAYS ASSUMING SUCCESSFUL RETURN TO MARKET, BOEING 737 MAX WILL BE IN DEMAND IN FUTURE YEARS .",down
2020-05-05,-0.02823,BOEING EXECUTIVE SAYS LOYAL WINGMAN UNMANNED FIGHTER DEVELOPED IN AUSTRALIA COULD BE IN PRODUCTION IN MIDDLE OF DECADE.,down
2020-05-05,-0.02823,ROYAL AUSTRALIAN AIR FORCE AIR VICE-MARSHAL SAYS INTENT IS TO WEAPONISE LOYAL WINGMAN UNMANNED FIGHTER IN FUTURE.,down
2020-05-05,-0.02823,LUFTHANSA CEO SAYS  WE ARE DISCUSSING POSTPONEMENT OF DELIVERIES OF UNNEEDED AIRCRAFT WITH AIRBUS AND BOEING.,down
2020-05-05,-0.02823,Lufthansa not planning to buy rivals weakened by COVID-19 crisis -CEO.,down
2020-05-05,-0.02823,"AERCAP HOLDINGS NV - AS OF MARCH 31, 2020, WE HAD 95 BOEING 737 MAX AIRCRAFT ON ORDER WITH BOEING AND FIVE ALREADY DELIVERED AND ON LEASE.",down
2020-05-05,-0.02823,ROYAL AUSTRALIAN AIR FORCE AND BOEING AUSTRALIA TO ROLL OUT FIRST LOYAL WINGMAN AIRCRAFT - GOVT STATEMENT .,down
2020-05-05,-0.02823,BRIEF-Aercap Holdings N.V. Reports Q1 Earnings Per Share Of $2.14.,down
2020-05-05,-0.02823,"UPDATE 1-Aircraft lessor AerCap boosts liquidity, defers jet deliveries.",down
2020-05-05,-0.02823,AERCAP HOLDINGS NV - ANY SUCH FUTURE DELAYS ON CO'S SCHEDULED BOEING 737 MAX DELIVERIES ARE LIKELY TO HAVE AN IMPACT ON OUR FINANCIAL RESULTS.,down
2020-05-05,-0.02823,"AERCAP HOLDINGS NV - BOEING 737 MAX LEASES CANCELLATIONS MAY HAVE ADVERSE EFFECT ON FUTURE CASH FLOWS & RESULTS OF OPERATIONS, WHICH COULD BE MATERIAL.",down
2020-05-05,-0.02823,"UPDATE 3-Virgin Atlantic to cut jobs, move flights from Gatwick as COVID-19 bites.",down
2020-05-05,-0.02823,AERCAP CEO SAYS EUROPEAN AIRLINE CEOS EXPECT LIMITED RETURN TO SERVICE IN MAY .,down
2020-05-05,-0.02823,UPDATE 2-Qantas secures more funding to wait out coronavirus crisis; shares rise.,down
2020-05-05,-0.02823,UPDATE 1-Lufthansa has no plans to buy rivals hit by coronavirus crisis -CEO.,down
2020-05-05,-0.02823,BRIEF-Australian Air Force And Boeing To Roll Out First Loyal Wingman Aircraft - Govt Statement.,down
2020-05-05,-0.02823,"UPDATE 1-Virgin Atlantic to cut 3,150 jobs; move flights to Heathrow from Gatwick.",down
2020-05-05,-0.02823,"Virgin Atlantic to cut 3,150 jobs after pandemic hits demand.",down
2020-05-05,-0.02823,BOEING EXECUTIVE SAYS UP TO 16 LOYAL WINGMAN UNMANNED FIGHTERS COULD BE TEAMED WITH A MANNED AIRCRAFT.,down
2020-05-05,-0.02823,BRIEF-AerCap CEO Says Deferred Over 60 Aircraft Deliveries - Conf Call.,down
2020-05-05,-0.02823,LUFTHANSA CEO SAYS  WE DON'T PLAN ACQUISITIONS OF OTHER AIRLINES.,down
2020-05-05,-0.02823,AERCAP HOLDINGS NV - EXPECT TO INCUR FUTURE DELAYS ON OUR SCHEDULED BOEING 737 MAX DELIVERIES.,down
2020-05-05,-0.02823,BOEING SELECTS ORBIT'S AUDIO MANAGEMENT SYSTEM (AMS) FOR NEW USAF TRAINER.,down
2020-05-05,-0.02823,AUSTRALIAN GOVT INVESTED UP TO $40 MLN IN BOEING LOYAL WINGMAN ADVANCED DEVELOPMENT PROGRAM - GOVT STATEMENT .,down
2020-05-05,-0.02823,AERCAP HOLDINGS NV - CERTAIN OF OUR BOEING 737 MAX LEASES HAVE NOW BEEN CANCELLED.,down
2020-05-05,-0.02823,"AERCAP HOLDINGS NV - IT IS UNCERTAIN, HOWEVER, WHEN AND UNDER WHAT CONDITIONS OUR BOEING 737 MAX AIRCRAFT WILL RETURN TO SERVICE.",down
2020-05-05,-0.02823,LUFTHANSA CHAIRMAN SAYS  COMPANY IS NOT SETTING CONDITIONS IN DISCUSSIONS WITH GOVT OVER STATE AID.,down
2020-05-05,-0.02823,AERCAP HOLDINGS NV - IT IS UNCERTAIN WHEN BOEING WILL RESUME MAKING DELIVERIES OF CO'S BOEING 737 MAX AIRCRAFT ON ORDER.,down
2020-05-05,-0.02823,BRIEF-Boeing Selects Orbit's Audio Management System (AMS) For New USAF Trainer.,down
2020-05-05,-0.02823,FACTBOX-Airlines get bailouts amid coronavirus shutdown .,down
2020-05-05,-0.02823,UPDATE 1-Boeing could produce Loyal Wingman fighter-like drone by middle of decade -exec.,down
