date,nextday_RET,headline,direction
2020-09-03,0.01351,"EMBRAER SA - EMBRAER ANNOUNCED 4.5% ADJUSTMENT TO GLOBAL WORKFORCE, WHICH CORRESPONDS TO ABOUT 900 EMPLOYEES IN BRAZIL .",up
2020-09-03,0.01351,"UPDATE 1-Brazil's Embraer says is cutting around 900 jobs, or 4.5% of its workforce.",up
2020-09-03,0.01351,Moody's changes Gogo's outlook to positive on announcement of planned CA business sale.,up
2020-09-03,0.01351,"Brazil's Embraer says is cutting around 900 jobs, or 4.5% of its workforce.",up
2020-09-03,0.01351,"UPDATE 2-Brazil's Embraer says is cutting its workforce by 4.5%, or  about 900 jobs.",up
2020-09-03,0.01351,EMBRAER ADJUSTS ITS STRUCTURE IN RESPONSE TO IMPACTS OF COVID-19 AND CANCELLATION OF PARTNERSHIP WITH BOEING.,up
2020-09-04,-0.058287,NYSE ORDER IMBALANCE <BA.N> 73899.0 SHARES ON SELL SIDE,down
2020-09-08,-0.001862,"BOEING - TAKING TIME TO THOROUGHLY INSPECT COMPLETED 787S TO ENSURE THEY ARE FREE OF ISSUES, MEET ALL ENGINEERING SPECIFICATIONS PRIOR TO DELIVERY.",down
2020-09-08,-0.001862,"BOEING SAYS DEBOOKED 20 ORDERS IN AUGUST, INCLUDING 3 787-10 FOR EVA AIR AND 17 MAX.",down
2020-09-08,-0.001862,BOEING SAYS ORDERS NET OF CANCELLATIONS AND CONVERSIONS THROUGH END OF AUGUST WERE -378 FOR THE YEAR.,down
2020-09-08,-0.001862,"Airbus jet deliveries slip in August, stays ahead of Boeing",down
2020-09-08,-0.001862,BOEING - EXPECT INSPECTIONS TO AFFECT TIMING OF 787 DELIVERIES IN THE NEAR-TERM.,down
2020-09-08,-0.001862,UPDATE 2-Boeing finds new 787 Dreamliner production problem.,down
2020-09-08,-0.001862,BOEING SAYS 13 COMMERCIAL AIRPLANES DELIVERED IN AUGUST.,down
2020-09-08,-0.001862,BOEING SAYS BOOKED 8 ORDERS IN AUGUST.,down
2020-09-08,-0.001862,BOEING SAYS GROSS ORDERS THROUGH END OF AUGUST WERE 67 FOR THE YEAR.,down
2020-09-08,-0.001862,PRESS DIGEST - Wall Street Journal - Sept 8.,down
2020-09-08,-0.001862,BOEING SAYS TOTAL BACKLOG AS OF END OF AUGUST WAS 4387 FOR THE YEAR.,down
2020-09-08,-0.001862,"BOEING SAYS AUG ORDERS INCLUDE PREVIOUSLY-ANNOUNCED ORDERS FOR 2 737S FROM ENTER AIR, 3 UNIDENTIFIED MAX ORDERS, 3 777 FREIGHT ORDERS FROM EVA AIR.",down
2020-09-08,-0.001862,BRIEF-Boeing Says Expect Inspections To Affect Timing Of 787 Deliveries In The Near-Term.,down
2020-09-08,-0.001862,"Boeing records first 737 MAX order in 2020, cancellations rise.",down
2020-09-08,-0.001862,BUZZ-Boeing falls as new 787 production problem to delay deliveries .,down
2020-09-08,-0.001862,"BOEING SAYS 17 MAXS CANCELED IN AUGUST INCLUDE 9 FOR AERCAP, 2 FOR AVIATION CAPITAL GROUP, 2 FOR ICELAND AIR, 1 FOR GECAS, 3 FOR UNIDENTIFIED CUSTOMERS.",down
2020-09-08,-0.001862,UPDATE 2-FAA investigating manufacturing flaws in Boeing 787 jetliners.,down
2020-09-08,-0.001862,"BOEING - QUALITY ASSURANCE PROGRAM IDENTIFIED DISTINCT ISSUES IN THE JOIN OF 787 AFTBODY FUSELAGE SECTIONS, AS WELL AS ON THE HORIZONTAL STABILIZER.",down
2020-09-08,-0.001862,"UPDATE 1-Boeing records first 737 MAX order in 2020, cancellations rise.",down
2020-09-08,-0.001862,BOEING SAYS TOTAL OF 87 AIRPLANES WERE DELIVERED THROUGH END OF AUGUST FOR THE YEAR.,down
2020-09-09,-0.019219,UPDATE 3-Boeing finds new 787 Dreamliner production problem.,down
2020-09-09,-0.019219,RYANAIR'S O'LEARY  HOPES TO BEGIN TAKING 737 MAX DELIVERIES IN JANUARY OR FEBRUARY; HOPEFULLY WILL TAKE 30-40 JETS IN TIME FOR NEXT SUMMER.,down
2020-09-09,-0.019219,Northrop Grumman wins $13.3 bln missile replacement contract .,down
2020-09-09,-0.019219,China's biggest airshow cancelled in 2020 over pandemic.,down
2020-09-09,-0.019219,RYANAIR'S O'LEARY  PRICING THIS WINTER IS GOING TO BE 'AGGRESSIVELY DOWN'.,down
2020-09-09,-0.019219,PRESS DIGEST- New York Times business news - Sept 9.,down
2020-09-09,-0.019219,RYANAIR'S O'LEARY:  WE MAY HAVE TO CUT BASES AND CUT SIZE OF BASES 'JUST TO GET THROUGH THIS WINTER' .,down
2020-09-09,-0.019219,CHINA'S BIGGEST AIRSHOW WILL GO AHEAD AS ORIGINALLY PLANNED IN ZHUHAI IN NOV 2020 - EVENT ORGANISER.,down
2020-09-09,-0.019219,Virgin Australia to cull a third of its Boeing 737 fleet under Bain ownership.,down
2020-09-09,-0.019219,RYANAIR'S O'LEARY:  WE ARE LOOKING AT CLOSING MORE BASES AND WITHDRAWING CAPACITY FROM COUNTRIES HANDLING COVID-19 BADLY.,down
2020-09-09,-0.019219,RYANAIR'S O'LEARY:  HOPES WILL REACH AN AGREEMENT WITH BOEING ON MAX COMPENSATION BY YEAR-END; DECLINES TO COMMENT ON POSSIBLE NEW PLANE ORDER.,down
2020-09-09,-0.019219,"RYANAIR'S O'LEARY: HARD BREXIT RISK RISING, BUT IN CONTEXT OF COVID-19, THREAT OF BREXIT DISRUPTION 'NOT THAT SIGNIFICANT'.",down
2020-09-09,-0.019219,BOEING - DANDRIDGE JOINS BOEING FROM AIG.,down
2020-09-09,-0.019219,"American Airlines says could seek larger Treasury loan, defer 737 MAX deliveries.",down
2020-09-09,-0.019219,UPDATE 3-U.S. airlines warn on travel recovery while awaiting fresh aid,down
2020-09-09,-0.019219,RYANAIR'S O'LEARY  RISK ON CAPACITY PLANS IS TO THE DOWNSIDE.,down
2020-09-09,-0.019219,BOEING APPOINTS DANDRIDGE TO LEAD COMMUNICATIONS.,down
2020-09-09,-0.019219,UPDATE 1-China's biggest airshow cancelled in 2020 over pandemic.,down
2020-09-09,-0.019219,UPDATE 2-China's biggest airshow to go ahead as originally planned - event organiser.,down
2020-09-09,-0.019219,"BOEING - NAMED ED DANDRIDGE AS COMPANY'S SENIOR VICE PRESIDENT AND CHIEF COMMUNICATIONS OFFICER, EFFECTIVE SEPT. 28.",down
2020-09-09,-0.019219,BUZZ-U.S. airlines descend after United cuts Q3 revenue forecast further.,down
2020-09-09,-0.019219,RYANAIR'S O'LEARY  EXPECTS TO OPERATE AT ABOUT 5 MILLION PASSENGERS PER MONTH OVER WINTER.,down
2020-09-09,-0.019219,RYANAIR'S O'LEARY:  'I THINK THE WINTER OF 2020 WILL ESSENTIALLY BE A WRITE-OFF'.,down
2020-09-09,-0.019219,UPDATE 2-U.S. airlines warn on travel recovery while awaiting fresh aid.,down
2020-09-09,-0.019219,BRIEF-China's biggest airshow to go ahead as originally planned - event organiser .,down
2020-09-09,-0.019219,UPDATE 1-American Airlines eyes more Treasury loans; unions meet with top Democrats.,down
2020-09-10,0.016108,U.S. SENATE COMMITTEE HOLDING SEPT. 16 HEARING ON BILL TO REFORM FAA OVERSIGHT OF AIRCRAFT CERTIFICATION FOLLOWING FATAL BOEING 737 MAX CRASHES -- COMMITTEE STATEMENT.,up
2020-09-10,0.016108,UAE aviation authority committed to return of Boeing B737 MAX.,up
2020-09-10,0.016108,"AIR NEW ZEALAND LTD - ""WE ARE NOT ANTICIPATING A RETURN TO ANY 777 FLYING UNTIL SEPT 2021 AT THE EARLIEST"".",up
2020-09-10,0.016108,EXCLUSIVE-Boeing to face independent ethics probe over lunar lander bid -document.,up
2020-09-10,0.016108,BRIEF-Air New Zealand Says Grounded Its Boeing 777 Fleet Until At Least Sept 2021.,up
2020-09-10,0.016108,U.S. Senate panel to take up FAA aircraft certification reform bill .,up
2020-09-10,0.016108,UPDATE 1-U.S. Senate panel to take up FAA aircraft certification reform bill.,up
2020-09-10,0.016108,NYSE ORDER IMBALANCE <BA.N> 60698.0 SHARES ON SELL SIDE,up
2020-09-10,0.016108,UAE CIVIL AVIATION AUTHORITY SAYS SPECIALIST TEAM MONITORING 737 MAX RECERTIFICATION ALSO WORKING WITH THE EUROPEAN UNION AVIATION SAFETY AGENCY - STATEMENT.,up
2020-09-10,0.016108,AIR NEW ZEALAND SAYS RECOVERY OF AIRLINEтАЩS INTERNATIONAL NETWORK POST-COVID-19 IS NOW LOOKING TO BE SLOWER THAN INITIALLY THOUGHT.,up
2020-09-10,0.016108,UAE CIVL AVIATION AUTHORITY SAYS COMMITTED TO ENSURE SAFE RETURN TO SERVICE FOR BOEING B737 MAX IN THE UAE - STATEMENT.,up
2020-09-10,0.016108,UAE CIVIL AVIATION AUTHORITY SAYS A DEDICATED SPECIALIST TEAM IS MONITORING THE CURRENT CERTIFICATION ACTIVITIES AND IMPLEMENTATION OF THE CORRECTIVE MEASURES FOR THE 737 MAX - STATEMENT.,up
2020-09-10,0.016108,BRIEF-Boeing Appoints Ed Dandridge To Lead Communications.,up
2020-09-10,0.016108,AIR NEW ZEALAND LTD - HAS GROUNDED ITS BOEING 777 FLEET UNTIL AT LEAST SEPTEMBER 2021.,up
2020-09-10,0.016108,UPDATE 1-UAE aviation authority committed to Boeing 737 MAX return .,up
2020-09-10,0.016108,UAE CIVIL AVIATION AUTHORITY SAYS CONTINUES TO WORK EXTENSIVELY WITH THE US FAA ABOUT THE RETURN TO SERVICE OF THE 737 MAX - STATEMENT.,up
2020-09-11,0.031954,Boeing in talks with FAA about new reported 787 production issue .,up
2020-09-11,0.031954,BOEING - CO AND THE SALT RIVER PROJECT (SRP) UTILITY HAVE SIGNED A MULTI-YEAR AGREEMENT TO POWER BOEINGтАЩS MESA SITE WITH RENEWABLE SOLAR ENERGY.,up
2020-09-11,0.031954,UPDATE 2-U.S. Senate panel to take up FAA aircraft certification reform bill.,up
2020-09-11,0.031954,RPT-BOEING CONFIRMS NEW PRODUCTION ISSUE IN SOME 787 DREAMLINERS AFTER PREVIOUSLY REPORTING THREE OTHER MANUFACTURING FLAWS -STATEMENT.,up
2020-09-11,0.031954,BOEING C ONFIRMS NEW PRODUCTION ISSUE IN SOME 787 DREAMLINERS AFTER PREVIOUSLY REPORTING THREE OTHER MANUFACTURING FLAWS -STATEMENT.,up
2020-09-11,0.031954,NYSE ORDER IMBALANCE <BA.N> 67662.0 SHARES ON BUY SIDE,up
2020-09-11,0.031954,UPDATE 1-Boeing in talks with FAA about new reported 787 production issue.,up
2020-09-14,-0.011249,NYSE ORDER IMBALANCE <BA.N> 449395.0 SHARES ON BUY SIDE,down
2020-09-14,-0.011249,"BUZZ-U.S. STOCKS ON THE MOVE-Oracle Corp, J.Jill, Nvidia Corp, Boeing Co.",down
2020-09-14,-0.011249,BUZZ-Boeing: Rises ahead of key 737 MAX training review begins in London.,down
2020-09-14,-0.011249,RPT-BUZZ-U.S. stocks weekly: Roller coaster.,down
2020-09-15,0.024283,EXCLUSIVE-GM exploring 'flying car' market using its Ultium electric battery-sources.,up
2020-09-15,0.024283,EXCLUSIVE-GM explores market for electric 'flying cars' -sources.,up
2020-09-15,0.024283,737 MAX crash victims seek U.S. legislation to block Boeing legal strategy,up
2020-09-15,0.024283,"GM SPOKESMAN SAYS COMPANY LOOKING AT AERIAL MOBILITY, DECLINES TO ELABORATE.",up
2020-09-15,0.024283,"Reuters Insider - U.S. Morning Call: Wall Street edges modestly higher ahead of Fed, Fedex. Citi, Boeing, Apple.",up
2020-09-15,0.024283,SPICEJET - LIKELY RETURN TO SERVICE OF BOEING'S MAX IN Q4 OF FY2021 TO BOOST OPS.,up
2020-09-15,0.024283,GM COULD MAKE ANNOUNCEMENT EARLY NEXT YEAR - SOURCES.,up
2020-09-15,0.024283,GENERAL MOTORS CO <GM.N> EXPLORING OPTIONS IN AERIAL TAXI MARKET - SOURCES.,up
2020-09-15,0.024283,"GM OPTIONS INCLUDE BUILDING, SUPPLYING OR PARTNERING AROUND ELECTRIC AIR TAXIS - SOURCES.",up
2020-09-16,0.0004179999999999,BOEING SAYS COOPERATED FULLY AND EXTENSIVELY WITH THE COMMITTEEтАЩS INQUIRY SINCE IT BEGAN IN EARLY 2019.,up
2020-09-16,0.0004179999999999,"BOEING - INCORPORATED MANY OF COMMITTEES, EXPERTS, AND GOVERNMENTAL AUTHORITIES RECOMMENDATIONS INTO THE 737 MAX AND OVERALL AIRPLANE DESIGN PROCESS.",up
2020-09-16,0.0004179999999999,"BUZZ-U.S. STOCKS ON THE MOVE-Ossen Innovation Co, Kindred Biosciences, Biocept Inc, Kaspien Holdings Inc.",up
2020-09-16,0.0004179999999999,UPDATE 2-U.S. Senate panel delays vote on aircraft certification reforms.,up
2020-09-16,0.0004179999999999,BOEING <BA.N> - CREATED A PERMANENT AEROSPACE SAFETY COMMITTEE OF OUR BOARD OF DIRECTORS AS WELL AS EXPANDED THE ROLE OF THE SAFETY PROMOTION CENTER..,up
2020-09-16,0.0004179999999999,"EXCLUSIVE-U.S. pushes arms sales surge to 'Fortress Taiwan,' needling China -sources.",up
2020-09-16,0.0004179999999999,"Reuters Insider - U.S. Morning Call: Fed watch, OECD, Data, Boeing, Facebook.",up
2020-09-16,0.0004179999999999,U.S. Senate panel delays consideration of FAA reform bill .,up
2020-09-16,0.0004179999999999,"EXCLUSIVE-U.S. pushes arms sales surge to Taiwan, needling China -sources.",up
2020-09-16,0.0004179999999999,NYSE ORDER IMBALANCE <BA.N> 107368.0 SHARES ON BUY SIDE,up
2020-09-16,0.0004179999999999,BOEING <BA.N> - HAVE SET UP A NEW SAFETY ORGANIZATION TO ENHANCE AND STANDARDIZE SAFETY PRACTICES.,up
2020-09-16,0.0004179999999999,"BOEING - REVISED DESIGN OF MAX HAS RECEIVED INTENSIVE INTERNAL & REGULATORY REVIEW, INCLUDING OVER 375,000 ENGINEERING & TEST HOURS & 1,300 TEST FLIGHTS.",up
2020-09-16,0.0004179999999999,"BUZZ-Boeing drops as U.S. House report blames planemaker, FAA for 737 MAX crashes.",up
2020-09-16,0.0004179999999999,"BOEING - ALSO TAKEN STEPS TO BOLSTER SAFETY ACROSS OUR COMPANY, CONSULTING OUTSIDE EXPERTS AND LEARNING FROM BEST PRACTICES IN OTHER INDUSTRIES.",up
2020-09-16,0.0004179999999999,BRIEF-Boeing Issues Statement On The House T&I Committee Report On 737 Max.,up
2020-09-16,0.0004179999999999,"U.S. House report blasts failures of Boeing, FAA in 737 MAX certification.",up
2020-09-16,0.0004179999999999,"BUZZ-U.S. STOCKS ON THE MOVE-ReTo Eco-Solutions, ADT Inc, AMC Networks Inc, General Motors Co.",up
2020-09-16,0.0004179999999999,BOEING STATEMENT ON THE HOUSE T&I COMMITTEE REPORT ON 737 MAX.,up
2020-09-16,0.0004179999999999,UPDATE 1-U.S. Senate panel delays consideration of FAA reform bill .,up
2020-09-16,0.0004179999999999,"UPDATE 1-Boeing, FAA failures to blame for 737 MAX crashes -U.S. House report.",up
2020-09-17,-0.038142,"BOEING - APPOINTMENTS OF MARC ALLEN,  CHRIS RAYMOND ARE EFFECTIVE OCT. 1.",down
2020-09-17,-0.038142,PRESS DIGEST-British Business - Sept 17.,down
2020-09-17,-0.038142,"BUZZ-U.S. STOCKS ON THE MOVE-Perrigo Company, Whiting Petroleum, Vaccinex Inc, Snowflake Inc.",down
2020-09-17,-0.038142,UPDATE 1-Southwest says half of grounded Boeing 737-800 planes back in service.,down
2020-09-17,-0.038142,UPDATE 1-Boeing 737 MAX crash victims urge more steps by FAA before flight approval.,down
2020-09-17,-0.038142,BOEING -  MARC ALLEN MOST RECENTLY SERVED AS PRESIDENT OF EMBRAER PARTNERSHIP AND GROUP OPERATIONS.,down
2020-09-17,-0.038142,PRESS DIGEST- Wall Street Journal - Sept 17.,down
2020-09-17,-0.038142,BOEING 737 MAX CRASH VICTIMS DEMAND FULL AERODYNAMIC REVIEW OF JET -FILING.,down
2020-09-17,-0.038142,UPDATE 1-Travellers snap up Asian airlines' scenic 'flights to nowhere' .,down
2020-09-17,-0.038142,"BUZZ-U.S. STOCKS ON THE MOVE-Sumo Logic Inc, 51job Inc, Nucor Corp, Apogee Enterprises Inc",down
2020-09-17,-0.038142,Asian airlines turn to 'flights to nowhere' to get travellers back in the skies.,down
2020-09-17,-0.038142,Southwest temporarily grounds 130 Boeing 737-800 airplanes over weight data.,down
2020-09-17,-0.038142,Boeing 737 MAX crash victims urge more steps by FAA before flight approval.,down
2020-09-17,-0.038142,BOEING SHARES DOWN 1.4% PREMARKET AFTER SOUTHWEST TEMPORARILY GROUNDS 130 BOEING 737-800 AIRPLANES OVER WEIGHT DATA DISCREPANCIES.,down
2020-09-17,-0.038142,"BOEING 737 MAX CRASH VICTIMS SAY SAFETY UPGRADES DO NOT ADDRESS UNDERLYING PROBLEMS, MAY CREATE OTHER FAILURE MODES -FILING.",down
2020-09-17,-0.038142,BUZZ-Boeing: Drops after Southwest temporarily grounds 130 BA aircraft.,down
2020-09-17,-0.038142,MEDIA LINK-Boeing and GAMECO to launch production line for converted freighters - Xinhua.,down
2020-09-17,-0.038142,BOEING APPOINTS MARC ALLEN CHIEF STRATEGY OFFICER AND NAMES CHRIS RAYMOND AS COMPANY'S FIRST CHIEF SUSTAINABILITY OFFICER.,down
2020-09-17,-0.038142,BOEING CRASH VICTIMS DEMAND PLANEMAKER ADD THIRD AIRFLOW SENSOR TO 737 MAX JET -FILING.,down
2020-09-17,-0.038142,"BUZZ-U.S. STOCKS ON THE MOVE-General Electric, Dave & Buster's Entertainment, Rigel Pharma, NuCana Plc.",down
2020-09-17,-0.038142,RPT-Southwest temporarily grounds 130 Boeing 737-800 airplanes over weight data.,down
2020-09-18,-0.029726,"BRIEF-Boeing, Honeywell And Rolls-Royce Deutschland Partner To Service H-47 Chinook Engines.",down
2020-09-18,-0.029726,BOEING - HONEYWELL TO LICENSE ROLLS-ROYCE DEUTSCHLAND AS PARTNER IN GERMANY TO PERFORM MAINTENANCE OF CHINOOK T-55 ENGINE OPERATED BY LUFTWAFFE.,down
2020-09-18,-0.029726,NYSE ORDER IMBALANCE <BA.N> 872527.0 SHARES ON SELL SIDE,down
2020-09-18,-0.029726,UPDATE 2-Boeing 737 MAX safety upgrades are 'positive progress' -NTSB .,down
2020-09-18,-0.029726,BOEING - AGREEMENT TO PROVIDE IN-SERVICE SUPPORT OF T-55 ENGINE IF GOVERNMENT OF GERMANY SELECT H-47 CHINOOK FOR STH HEAVY-LIFT HELICOPTER REQUIREMENT.,down
2020-09-18,-0.029726,BRIEF-AerSale Agrees To Acquire 24 Boeing 757-200 Passenger Aircraft.,down
2020-09-18,-0.029726,"AERSALE - AIRCRAFT ARE EQUIPPED WITH ROLLS-ROYCE RB211-535 SERIES ENGINES, AND 16 SPARES ARE INCLUDED WITH PURCHASE.",down
2020-09-18,-0.029726,"BOEING, HONEYWELL AND ROLLS-ROYCE DEUTSCHLAND PARTNER TO SERVICE H-47 CHINOOK ENGINES.",down
2020-09-21,0.002878,UPDATE 2-American Airlines begins scheduling Boeing 737 MAX pilot training .,up
2020-09-21,0.002878,"BRIEF-Boeing Wins More 737-800BCF Orders, Launches New Freighter Conversion Lines.",up
2020-09-21,0.002878,"MOODY'S CONFIRMS AERCAP'S BAA3 LONG-TERM SENIOR UNSECURED RATING, CONCLUDING REVIEW; OUTLOOK IS NEGATIVE.",up
2020-09-21,0.002878,BOEING - 737-800BCF NOW HAS 134 ORDERS AND COMMITMENTS.,up
2020-09-21,0.002878,"Moody's confirms DAE Funding LLC's Baa3 long-term senior unsecured rating, concluding review; outlook is negative.",up
2020-09-21,0.002878,"American Airlines to begin Boeing 737 MAX pilot training in Nov, memo shows.",up
2020-09-21,0.002878,BUZZ-Goldman Sachs sees quicker recovery for aerospace stocks .,up
2020-09-21,0.002878,AMERICAN AIRLINES SAYS NO DEFINITIVE PLANS FOR BOEING 737 MAX TRAINING; CAN CANCEL PILOT TRAINING SCHEDULING IF THE MAX ISN'T RECERTIFIED - SPOKESMAN.,up
2020-09-21,0.002878,BOEING - TWO ADDITIONAL FREIGHTER CONVERSION LINES ARE LAUNCHED TO MEET STRONG DEMAND IN EXPRESS TRAFFIC AND E-COMMERCE MARKETS.,up
2020-09-21,0.002878,BRIEF-American Airlines Says No Definitive Plans For Boeing 737 Max Training Can Cancel Pilot Training Scheduling If The Max Isn't Recertified - Spokesman.,up
2020-09-21,0.002878,"UPDATE 1-American Airlines to begin Boeing 737 MAX pilot training in Nov, memo shows.",up
2020-09-21,0.002878,UPDATE 2-Rolls-Royce shares hit 16-year low on mooted $3 bln equity raising.,up
2020-09-21,0.002878,'Who is our enemy?' Neutral Switzerland votes on fighter jets.,up
2020-09-21,0.002878,"AMERICAN AIRLINES' 737 MAX SPECIAL TRAINING REFLECTS PLANNED RETURN TO SERVICE 'IN THE NEAR FUTURE', MEMO SAYS.",up
2020-09-21,0.002878,BOEING -  ANNOUNCED A FIRM ORDER FROM AN UNIDENTIFIED CUSTOMER FOR TWO 737-800 BOEING CONVERTED FREIGHTERS (BCF).,up
2020-09-21,0.002878,"AMERICAN AIRLINES' 737 MAX TRAINING CONSISTS OF A DISTANCE LEARNING TRAINING MODULE AND A SIMULATOR SESSION, MEMO SAYS.",up
2020-09-21,0.002878,"AMERICAN AIRLINES TO BEGIN BOEING 737 MAX TRAINING FOR ITS PILOTS IN NOVEMBER, ACCORDING TO MEMO TO PILOTS.",up
2020-09-21,0.002878,"BOEING <BA.N>, RAYTHEON TECHNOLOGIES CORP <RTX.N>: GOLDMAN SACHS ADDS STOCKS TO ITS CONVICTION LIST.",up
2020-09-21,0.002878,MEDIA-Boeing whistle-blower says proposed 737 MAX fixes arenтАЩt enough - Bloomberg News.,up
2020-09-21,0.002878,"MOODY'S CONFIRMS DAE FUNDING LLC'S BAA3 LONG-TERM SENIOR UNSECURED RATING, CONCLUDING REVIEW; OUTLOOK IS NEGATIVE.",up
2020-09-21,0.002878,"MOODY'S CONFIRMS THE BAA3 LONG-TERM ISSUER RATING OF AVOLON HOLDINGS, CONCLUDING REVIEW; OUTLOOK IS NEGATIVE.",up
2020-09-21,0.002878,"Moody's confirms AerCap's Baa3 long-term senior unsecured rating, concluding review; outlook is negative.",up
2020-09-21,0.002878,"Moody's confirms the Baa3 long-term issuer rating of Avolon Holdings, concluding review; outlook is negative",up
2020-09-21,0.002878,FOCUS-Boeing gearing up for 787 move to South Carolina -sources.,up
2020-09-21,0.002878,"Boeing books two 737-800BCF orders, says new freighter conversion lines opening.",up
2020-09-21,0.002878,BOEING WINS MORE 737-800BCF ORDERS AND LAUNCHES NEW FREIGHTER CONVERSION LINES TO MEET STRONG DEMAND.,up
2020-09-22,-0.035842,UPDATE 2-Pilots' unions urge U.S. regulator to improve cockpit procedures for Boeing 737 MAX.,down
2020-09-22,-0.035842,BRIEF-Boeing Licenses Ultraviolet Wand to Healthe Inc to Counter COVID-19.,down
2020-09-22,-0.035842,TWO SENATE DEMOCRATS WANT FAA TO DISCLOSE ANY INTERNAL OBJECTIONS BY EMPLOYEES TO THE PROPOSED CHANGES TO BOEING 737 MAX -- STATEMENT.,down
2020-09-22,-0.035842,AIRBUS CEO FAURY SAYS  SITUATION WITH AIRLINES WORSE THAN WE THOUGHT SINCE SUMMER.,down
2020-09-22,-0.035842,BRIEF-Airbus CEO: can't guarantee there won't be compulsory redundancies.,down
2020-09-22,-0.035842,"BOEING LICENSES ULTRAVIOLET WAND TO HEALTHE, INC. TO COUNTER COVID-19.",down
2020-09-22,-0.035842,UPDATE 1-Two Senate Democrats want FAA to release data on Boeing 737 MAX review.,down
2020-09-22,-0.035842,AIRBUS CEO FAURY SAYS  WILL BE DIFFICULT TO RESTRICT OURSELVES TO VOLUNTARY REDUNDANCIES GLOBALLY.,down
2020-09-22,-0.035842,MEDIA-UK in talks to cut controversial Boeing contract for early-warning radar jets - The Telegraph,down
2020-09-22,-0.035842,Airbus CEO: we can't guarantee no compulsory layoffs.,down
2020-09-22,-0.035842,Two Senate Democrats want FAA to release data on Boeing 737 MAX review.,down
2020-09-22,-0.035842,AIRBUS CEO FAURY SAYS  CANNOT GUARANTEE THERE WILL BE NO COMPULSORY REDUNDANCIES.,down
2020-09-22,-0.035842,AIRBUS CEO FAURY SAYS  THERE ARE MANY MEASURES WE CAN ADOPT ASIDE FROM COMPULSORY REDUNDANCIES.,down
2020-09-22,-0.035842,UPDATE 1-World's largest pilots' union asks U.S. to improve cockpit procedures for Boeing 737 MAX.,down
2020-09-22,-0.035842,World's largest pilots' union asks U.S. to improve cockpit procedures for Boeing 737 MAX.,down
2020-09-23,-0.033933,BRIEF-China Development Bank Financial Leasing Announces Purchase And Leaseback Of 12 Aircraft.,down
2020-09-23,-0.033933,NYSE ORDER IMBALANCE <BA.N> 58545.0 SHARES ON BUY SIDE,down
2020-09-23,-0.033933,"CHINA DEVELOPMENT BANK FINANCIAL LEASING-UNITED TO ASSIGN TO UNIT OF CO UNITED'S RIGHT TO PURCHASE, TAKE DELIVERY OF EACH 2 NEW BOEING 787-9 AIRCRAFT.",down
2020-09-23,-0.033933,"BOEING CO DIPS IN HEAVY VOLUME, SHARES LAST DOWN 2.9%.",down
2020-09-23,-0.033933,PRESS DIGEST-British Business - Sept 23.,down
2020-09-24,0.068333,BOEING - A CONTRACT AWARD IS EXPECTED LATER THIS YEAR.,up
2020-09-24,0.068333,"MOODY'S AFFIRMS SPIRIT AEROSYSTEMS CFR (B2), ASSIGNS BA2 TO NEW FIRST LIEN DEBT.",up
2020-09-24,0.068333,"BOEING CO DIPS IN VOLUME SURGE, STOCK LAST DOWN 3.1%.",up
2020-09-24,0.068333,EXCLUSIVE-Airbus holds jet output stable after crisis review -sources.,up
2020-09-24,0.068333,"MEDIA-Impresa, parts maker for Boeing 737 MAX, files for bankruptcy- WSJ.",up
2020-09-24,0.068333,"Moody's affirms Spirit AeroSystems CFR (B2), assigns Ba2 to new first lien debt",up
2020-09-24,0.068333,Airline passengers want to see barriers to boost confidence - industry execs.,up
2020-09-24,0.068333,"BRIEF-Boeing Partners With General Atomics, Aerojet Rocketdyne In Homeland Missile Defense Bid.",up
2020-09-24,0.068333,BOEING - NORTHROP GRUMMAN WILL SERVE AS A COMPONENT SUPPLIER ON THE BOEING-LED TEAM.,up
2020-09-24,0.068333,EXCLUSIVE-Airbus holds jet output stable in face of crisis warnings -sources.,up
2020-09-24,0.068333,EXCLUSIVE-Airbus to hold jet output stable in face of crisis warnings -sources.,up
2020-09-24,0.068333,"BOEING - BOEING PARTNERS WITH GENERAL ATOMICS, AEROJET ROCKETDYNE IN HOMELAND MISSILE DEFENSE BID.",up
2020-09-25,0.064411,"BUZZ-U.S. STOCKS ON THE MOVE-Splunk Inc, VF Corp, Sunworks Inc, Rite Aid Corp.",up
2020-09-25,0.064411,"EASA HEAD SAYS BOEING <BA.N> HAS AGREED TO INSTALL A ""SYNTHETIC"" THIRD FLIGHT-ANGLE SENSOR ON NEXT VERSION OF 737 MAX.",up
2020-09-25,0.064411,"EASA HEAD SAYS EXPECTS TECHNICAL APPROVAL FOR BOEING 737 MAX AROUND NOVEMBER, OPERATIONAL CLEARANCES FOR EACH AIRILNE MAY TAKE LONGER.",up
2020-09-25,0.064411,UPDATE 3-Europe regulator sees November lifting of Boeing 737 MAX flight ban.,up
2020-09-25,0.064411,"BOEING SHARES JUMP ON NEWS FAA WILL CONDUCT EVALUATION FLIGHT OF 737 MAX NEXT WEEK, STOCK LAST UP 6.1%.",up
2020-09-25,0.064411,NYSE ORDER IMBALANCE <BA.N> 100977.0 SHARES ON BUY SIDE.,up
2020-09-25,0.064411,"EU AVIATAION SAFETY CHIEF SAYS FLIGHT TESTS OF BOEING 737 MAX ""WENT WELL,"" END OF WORK ON AIRCRAFT IS IN SIGHT.",up
2020-09-25,0.064411,"BUZZ-Raytheon Technologies: Cowen sees slow recovery, cuts PT .",up
2020-09-25,0.064411,FAA chief set to conduct 737 MAX evaluation flight next week.,up
2020-09-25,0.064411,"Reuters Insider - U.S. Morning Call: Futures point to a lower Wall Street open, Novavax, 737.",up
2020-09-25,0.064411,Europe regulator sees November lifting of Boeing 737 MAX flight ban.,up
2020-09-25,0.064411,FEDERAL AVIATION ADMINISTRATION CHIEF DICKSON IS SET TO CONDUCT 737 MAX EVALUATION FLIGHT NEXT WEDNESDAY -- OFFICIALS.,up
2020-09-25,0.064411,PRESS DIGEST- Wall Street Journal - Sept. 25 .,up
2020-09-25,0.064411,"BOEING JUMPS IN VOLUME SPIKE, STOCK LAST UP 5.1%.",up
2020-09-25,0.064411,BUZZ-Boeing: Rises as FAA to conduct evaluation of 737 MAX next week.,up
2020-09-25,0.064411,BOEING SHARES UP 1.4% AFTER EUROPE REGULATOR SAYS 737 MAX BAN COULD LIFT IN NOVEMBER .,up
2020-09-25,0.064411,BUZZ-Boeing: Up after Europe regulator says 737 MAX ban could lift in November .,up
2020-09-25,0.064411,"MOODY'S DOWNGRADES VOYAGER AVIATION HOLDINGS' LONG-TERM SENIOR UNSECURED DEBT RATING TO CAA2 FROM B2, OUTLOOK REMAINS NEGATIVE.",up
2020-09-25,0.064411,EASA HEAD SAYS FOCUSED ON HOW BOEING 737 MAX WILL BE RETURNED TO SERVICE BY THE END OF THE YEAR.,up
2020-09-25,0.064411,UPDATE 2-Europe regulator sees November lifting of Boeing 737 MAX flight ban.,up
2020-09-25,0.064411,SpaceX handed loss in challenge over Air Force contract .,up
2020-09-25,0.064411,UPDATE 1-Europe regulator sees November lifting of Boeing 737 MAX flight ban.,up
2020-09-25,0.064411,EASA HEAD SAYS WILL EXAMINE BOEING 777X DEVELOPMENT MUCH MORE CLOSELY FOLLOWING 737 MAX GROUNDING.,up
2020-09-25,0.064411,"Moody's downgrades Voyager Aviation Holdings' long-term senior unsecured debt rating to Caa2 from B2, outlook remains negative.",up
2020-09-25,0.064411,"BUZZ-U.S. STOCKS ON THE MOVE-Boxlight Corp, Tenable Holdings Inc, Rite Aid Corp, Sunworks Inc.",up
2020-09-25,0.064411,UPDATE 2-FAA chief set to conduct 737 MAX evaluation flight next week,up
2020-09-25,0.064411,UPDATE 1-FAA chief set to conduct 737 MAX evaluation flight next week.,up
2020-09-28,-0.014933,"U.S. RESEARCH ROUNDUP-Expedia Group, MercadoLibre, Mettler-Toledo International.",down
2020-09-28,-0.014933,BRIEF-Abu Dhabi's EPI To Manufacture Boeing 787 Dreamliner Metallic Parts .,down
